Title,Image URL,Description
No disponible,https://es.web.img2.acsta.net/c_310_420/pictures/14/02/07/12/04/285360.jpg,"Esta serie, creada y producida por Dick Wolf ('Ley y orden', 'Corrupción en Miami'), es la primera y más importante secuela de la exitosa 'Ley y orden', que se convirtió en una de las series más longevas de la televisión -tan solo superada por 'Los Simpson'. En el 'spin-off', y a través del trabajo que realiza la Unidad de Víctimas Especiales, se narran los diferentes crímenes y asesinatos que tienen lugar en la ciudad de Nueva York. Al mando de esta unidad, cuyo principal objetivo son los casos de crímenes sexuales y abuso infantil, se encuentran los experimentados detectives Elliot Stabler (Christopher Meloni, 'Novia a la fuga', 'Dos colgaos muy fumaos', 'True Blood'), John Munch (Richard Belzer, 'Lois y Clark', 'Homicidio', 'Arrested Development') y sus compañeros Olivia Benson (Mariska Hargitay, 'Urgencias') y Brian Cassidy (Dean Winters, 'Rescue Me'). Esta brigada se enfrentará a depravados sexuales, maniáticos, asesinos y violadores en serie. La serie ahonda en la vida privada de los personajes y en su forma de ser. Además, también racoge cómo influye su tarea laboral a su espacio íntimo. La serie tiene un carácter procedimental y es considerada una de las mejores en la gestión del suspense. Cuenta con una estructura que abre cada episodio con un nuevo caso y lo termina con la resolución del mismo. En esto se parece a otros títulos del género como 'Bones', 'CSI', 'Castle', 'Sin Rastro' o 'Mentes Criminales'."
No disponible,https://es.web.img3.acsta.net/c_310_420/pictures/18/09/11/09/24/3649571.jpg,"Élite es una producción española para Netflix en la que su historia se desarrolla en Las Encinas, un colegio exclusivo del país. Allí acuden a estudiar los hijos de la élite. Un día, la ciudad sufre un gran terremoto que destruye el colegio público y los alumnos se ven obligados a ser repartidos por otras escuelas de la localidad.  Tres jóvenes de clase obrera, Samuel, Nadia y Christian, son admitidos en Las Encinas, en ese momento la lucha por las diferencias de clases comienzan hasta acabar con un asesinato. Todos se preguntan quién ha podido cometer el crimen. Marina es una joven que decide ser amiga de los recién llegados, teniendo una especial relación con Samuel, cuyos actos son motivados por la honestidad y la honradez. Christian es muy diferente, la fiesta es su día a día y sus estrictos padres quieren alejarle de ello para que estudie y enfoque su vida. Si hay alguien que tiene claro su futuro es Nadia, cuyos padres son musulmanes y dueños de una tienda de alimentación y tiene claro que la educación es la mejor vía para llegar a ser diplomática o traductora en la ONU."
No disponible,https://es.web.img2.acsta.net/c_310_420/pictures/15/10/23/08/59/222051.jpg?coixp=45&coiyp=64,"Peaky Blinders es un drama de BBC que narra la historia de la familia gitana Shelby y su banda de gángsters, un grupo de personas características por sus boinas con cuchillas y dueñas de los asuntos ilegales, que dominan las apuestas clandestinas y se rigen mediante extorsiones. La historia comienza en el Birmingham (Reino Unido) de los años 20 cuando un joven Tomas (Tommy) Shelby regresa de la guerra tras combatir contra los franceses para ocuparse del negocio familiar regentado, durante su ausencia, por su tía Polly Gray. Sin embargo, una vez que llega a su tierra, todo son problemas. Dirigir un negocio criminal no es tarea fácil, y menos si aún están presente las secuelas psicológicas que conlleva estar en la guerra. Además, los desencuentros políticos hacen que se cree una brecha entre su mejor amigo de la infancia Freddie, con ideas comunistas, y su hermana Ada, quienes mantienen una relación a espaldas de la familia y, sobre todo, de Tommy. Las disputas también aparecen en el terreno de lo profesional, pues tiene varios encontronazos con diferentes enemigos, siendo el más importante un capitán de policía recién llegado de Belfast que se ha propuesto limpiar el lugar de criminales, gángsters y todo aquel que esté en contra de las leyes que dicta el país, siendo su principal cometido el de recuperar unas armas interceptadas por los Shelby. Peaky Blinders está protagonizada por la estrella Cillian Murphy, protagonista de Luces rojas; y Sam Neill (Plan de Escape). Además, el creador y guionista de la serie se trata nada menos que de Steven Knight, creador de la historia de Promesas del Este."
No disponible,https://es.web.img3.acsta.net/c_310_420/pictures/18/05/16/09/29/5203734.jpg,"The Rookie sigue la historia de John Nolan, un hombre de cuarenta años que decide dejar su cómoda vida en un pequeño pueblo para trasladarse a la ciudad de Los Ángeles a cumplir su sueño de convertirse en policía. Así, se tiene que enfrentar a los retos que plantea el mundo criminal para los agentes recién llegados a la profesión. Talia, una de sus superiores, obliga a Nolan a confrontar sus inclinaciones morales en uno de sus primeros días después de encontrarse con una víctima de secuestro. Por otro lado, Lucy se coloca temporalmente con un nuevo oficial de entrenamiento que pone a prueba su paciencia."
No disponible,https://es.web.img2.acsta.net/c_310_420/img/93/90/9390c6e975c9ebd03b5729d9e959dda9.jpg,"Morgan, una madre soltera de tres hijos con una inteligencia excepcional, trabaja como limpiadora en el departamento de policía para mantener a su familia. Durante uno de sus turnos nocturnos, mientras revisa las pruebas de un caso que lleva años sin resolverse, se da cuenta de que algunas pistas han sido mal interpretadas. Con su mente analítica y detallista, decide reorganizar las pruebas de manera discreta, revelando nuevas conexiones que los investigadores habían pasado por alto."
No disponible,https://es.web.img3.acsta.net/c_310_420/pictures/15/09/24/09/51/514754.jpg,"Chicago PD cuenta la historia del Departamento de Policía de Windy Cities de Chicago y se trata del 'spin-off' de Chicago Fire de NBC. La serie se centra en la patrulla de Policía y la Unidad de Inteligencia que persigue a los responsables de los delitos en la ciudad, crimen organizado, el tráfico de estupefacientes y homicidios mayores. En el departamento está el detective Hank Voight (Jason Beghem, 'Phantom'), el inspector Antonio Dawson (Jon Seda, 'Una bala en la cabeza'), la oficial de policía Nicole (Tania Raymonde, 'Perdidos'), un miembro del equipo de investigación CPD que tiene un pasado un tanto sospechado y que nadie conoce, entre otros."
No disponible,https://es.web.img3.acsta.net/c_310_420/pictures/14/01/17/13/00/493022.jpg,"True Detective es una serie thriller dramática que en cada una de sus temporadas nos presenta, en formato antológico y con una narrativa independiente, varias investigaciones policiales que desenterrarán los secretos personales y profesionales de los agentes involucrados. Martin Hart y Rustin Cohle son la pareja de detectives que, durante diecisiete años, siguen la pista de un asesino en serie que comete terribles asesinatos ligados a rituales satánicos. Intentando establecer un patrón para resolver estos monstruosos crímenes la relación de Cohle y Hart se irá fracturando. Mientras, se verán inmersos en una obsesiva espiral que les llevará a una turbia conspiración de desapariciones ligada a un pastor evangélico de las altas esferas del poder político de Luisiana. Por su parte, las vidas de los agentes Ray Velcoro, Ani Bezzerides y Paul Woodrugh se cruzan al descubrir que un funcionario municipal ha sido asesinado. Obligados a trabajar juntos, a medida que avanza la investigación de este crimen, los detectives encuentran vínculos con una turbia trama de corrupción urbanística y extorsión a poderosas personalidades con vídeos sexuales, una trama que conecta con un misterioso robo de diamantes que ocasionó un sangriento doble asesinato muchos años antes. En Arkansas, Wayne Hays y Roland West investigan la extraña desaparición de dos hermanos. Cuando el cuerpo del niño aparece en un bosque, asesinado con señales de aparentes rituales de brujería, el caso da un vuelco perturbador. Mientras la niña permanece desaparecida y tratan de encontrarla, el caso seguirá abierto y esto perturbará emocionalmente las vidas personales de los dos investigadores. Ennis, un lejano pueblo de Alaska donde la noche invernal puede durar más de 24 horas. Allí seis hombres que trabajan en la Estación de investigación ártica desaparecen sin dejar rastro. Para tratar de esclarecer los hechos, las detectives Liz Danvers y Evangeline Navarro tendrán que enfrentarse a la oscuridad para indagar la turbia verdad que yace enterrada bajo el hielo."
No disponible,https://es.web.img3.acsta.net/c_310_420/pictures/19/03/21/16/47/4408459.jpg,"Astrid et Raphaëlle, Bright Minds en España, es una serie policial que sigue a dos mujeres policía fuertes que forman un equipo para luchar contra el crimen y resolver los casos de asesinato más difíciles del país. Astrid es discreta, ordenada y sufre del síndrome de Asperger que afecta a la interacción social recíproca y a la comunicación verbal. Es una mujer metódica y organizada que necesita puntos de referencia y no tolera la improvisación ni las situaciones inesperadas. Por otro lado, Raphaëlle es totalmente opuesta a Astrid. Es madre de un hijo, espontánea, le cuesta mucho centrarse y desordenada. Su día a día cambiará radicalmente cuando se encuentra en su vida con Astrid, la misma que gracias a sus conocimientos, la ayudará a resolver casos más complicados."
No disponible,https://es.web.img3.acsta.net/c_310_420/pictures/17/05/17/17/04/361994.jpg,"S.W.A.T. es una ficción policial y militar que sigue al teniente afro-americano del equipo SWAT (Special Weapons And Tactics, Armas y Tácticas Especiales) que es el responsable de organizar y coordinar a un nuevo equipo de militares altamente capacitados para trabajar en todo tipo de casos, y serán los encargados de resolver una serie de crímenes de Los Ángeles. Sin embargo, esa no será la única dificultad que se encuentre en su camno, pues el teniente está constantemente dividido entre la lealtad a sus compañeros y la que siente por la gente de la calle.Esta ficción es un 'reboot' de la serie homónima de 1975, que a su vez tuvo varias adaptaciones cinematográficas con las películas S.W.A.T. Los hombres de Harrelson (2003) y S.W.A.T.: Operación especial (2011)."
No disponible,https://es.web.img2.acsta.net/c_310_420/pictures/17/02/20/08/59/547853.jpg,"Miguel Palacios es un policía que está preso en una cárcel perdida en medio de la nada. Un día, un juez le convoca para que le ayude a resolver el secuestro de su hija. Para ello, Miguel debe cambiar de identidad para infiltrarse en la cárcel de San Onofre, en Buenos Aires, e intentar encontrar información sobre la banda que opera en la prisión. Según el juez, este grupo es el responsable del secuestro de su hija y Miguel es el único que puede dar con la verdad. Así, el policía se convierte en Pastor Peña y se infiltra en un mundo donde un mínimo error puede acabar con su vida."
No disponible,https://es.web.img3.acsta.net/c_310_420/pictures/14/02/21/12/35/496849.jpg,"Serie de la CBS que sigue los casos de un grupo de agentes del servicio de investigación de la Marina. Esta producción surge como 'spin-off' de 'JAG: Alerta Roja' y es presentada en la misma mediante un episodio doble de la octava temporada, donde se introduce el concepto de la nueva serie y se presenta a sus personajes. Ambas ficciones llegan de manos del creador Donald P. Bellisario. El Investigador Jefe de esta brigada es Leroy Jethro Gibbs (Mark Harmon, 'El ala oeste de la Casa Blanca', 'Ponte en mi lugar'), ex Sargento de Infantería de la Marina, francotirador experimentado e infalible en los interrogatorios. El resto del equipo estña formado por los agentes especiales Kate Todd (Sasha Alexander, 'Dawson Crece') y Tony DiNozzo (Michael Weatherly, 'Dark Angel') entre otros. El Servicio de Investigación Criminal Naval, que responde al acrónimo NCIS -de ahí el título de la serie original-, es la principal agencia estadounidense en seguridad, refuerzo de leyes, contrainteligencia y contraterrorismo de la Marina. A casos de esta índole se enfrentarán nuestros protagonistas para mantener la seguridad de los miembros de la armada de EE.UU. y sus familias."
No disponible,https://es.web.img2.acsta.net/c_310_420/pictures/15/08/25/13/24/395336.jpg,"'CSI: Crime Scene Investigation', comúnmente conocida como 'CSI: Las Vegas' en España, es una serie de exitosa y larga trayectoria creada por Anthony E. Zuiker y producida por Jerry Bruckheimer ('Sin rastro', 'Miami Medical', 'Pearl Harbor', 'Piratas del Caribe', 'Armageddon'). Se traslada al espectador a la ciudad de Las Vegas, dónde la unidad de policía científica utiliza lo último en tecnología para analizar pruebas y resolver casos relacionados con asesinatos. Al mando de este grupo de investigadores encontramos a Gil Grissom (William Petersen, 'Detachment'), voz de la moral en el difícil mundo de la investigación policial y experto, entre otras materías desde Entomología o Música hasta Mitología y Filosofía. El resto de los integrantes del grupo son: Catherine Willows (Marg Helgenberger, 'Erin Brockovich'), Nick Stokes (George Eads, 'Urgencias'), Warrick Brown (Gary Dourdan, 'The Office') y Sara Sidle (Jorja Fox, 'Memento'). Los diferentes casos a resolver pondrán a prueba el ingenio de este equipo de especialistas. La serie, básicamente, está centrada en torno al caso o casos que aparecen en cada episodio. Las relaciones entre los personajes están en un segundo plano aunque, según avanza la serie, se puede notar que los conflictos entre los protagonistas ganan algo de peso en comparación con la resolución de los crímenes."
No disponible,https://es.web.img3.acsta.net/c_310_420/pictures/14/02/14/13/31/367985.jpg,"Esta serie de investigación policial creada por Jeff Davis ('Lobo adolescente') propone una forma nueva para la resolución de crímenes diferente a la clásica investigación -estilo Sherlock Holmes- donde se necesitan pruebas tangibles para apoyar el proceso deductivo del investigador. La serie, al contrario de lo que estamos acostumbrados por títulos como 'Castle', 'Bones' o incluso 'CSI', explota la empatía con el asesino. Cuando no hay posibilidad de avance en un caso de asesinatos en serie, el FBI recurre a la Unidad de Análisis de conducta de Quantico (Virginia) liderada por Jason Gideon (Mandy Patinkin, 'Dick Tracy') y Aaron Hotchner (Thomas Gibson, 'Dharma y Greg'). La especialidad de esta brigada es analizar en profundidad la mente de los asesinos en serie más retorcidos del país para así anticiparse a sus próximos movimientos. Mientras los detectives ordinarios estudian las pruebas del crimen, este equipo especial analiza el comportamiento del criminal para determinar el móvil del sospechoso. Su búsqueda se realiza desde dentro hacia fuera; no a través del examen de las pruebas en el laboratorio, sino estudiando la conducta del delincuente tanto en la escena del crimen como en el lugar donde vive o trabaja con el fin de saber cómo piensan y, sobre todo, cómo van a actuar."
No disponible,https://es.web.img3.acsta.net/c_310_420/pictures/15/09/24/09/46/407839.jpg,"'El Mentalista' es una producción de CBS que trata la historia de Patrick Jane (Simon Baker, 'The Guardian', 'Not Forgotten', 'El diablo viste de Prada'), un apuesto hombre de mediana edad con una capacidad de observación sobrenatural. Esta serie nos llega de manos de Bruno Heller, al que también debemos otra serie de éxito como es 'Roma'. Nuestro protagonista tiene un pasado del que no puede sentirse precisamente orgulloso. Utilizaba su gran poder deductivo, lógica y observación para trabajar como médium falso. Sus engaños le dieron dinero y fama hasta que se metió en aguas demasiado profundas criticando públicamente al asesino en serie John 'El Rojo'. Este asesinó brutalmente a su mujer e hija y propició que Jane dejase de utilizar sus habilidades para embaucar a la gente. En la actualidad, nuestro mentalista colabora con el -ficticio en la vida real- CBI (California Bureau of Investigation) utilizando sus cualidades únicas para ayudar en la resolución de crímenes. Junto a la agente Teresa Lisbon (Robin Tunney, 'Prison Break') y su equipo se enfrentará a los casos más complicados y los más intrincados acertijos para resolverlos. Trabajar junto a la policía le acercará más al asesino que acabo con su familia... Jane no tiene reparos en decir que cuando lo encuentre lo matará en lugar de llevarlo delante de la justicia... ¿Será capaz de hacerlo?"
No disponible,https://es.web.img3.acsta.net/c_310_420/medias/nmedia/18/96/66/98/20482429.jpg,"Miniseria dramática de corte policial en la que un detective regresa a su pueblo natal tras varios años de ausencia. Las islas Shetland son el hogar natal del detective Jimmy Perez (Douglas Henshall, 'The Kidnap Diaries', 'The Silence'), pero lo dejó atrás para iniciar su carrera como investigador. Ahora, años después, ha regresado a casa dispuesto a defender a sus compatriotas y vecinos de cualquier mal que amenace la tranquila vida de las islas. Por ello, cuando un joven arqueólogo encuentra algunos huesos humanos que evidencian muertas violentas y una mujer es asesinada de un disparo, Jimmy y su equipo deciden encontrar a los responsables a como dé lugar. De esta forma se ve atrapado entre dos importantes familias marcadas por el odio, la envidia y la traición, y cuyo enfrentamiento a dividido a los tranquilos habitantes de las Shetland."
No disponible,https://es.web.img2.acsta.net/c_310_420/pictures/21/12/03/10/38/4833003.jpg,"Reacher es una serie dramática de acción basada en el personaje creado por el escritor británico Lee Child, autor de la saga de novelas súperventas protagonizada por Jack Reacher. Cuando el veterano del ejército de los Estados Unidos Jack Reacher es arrestado por un homicidio que no cometió, pronto se dará cuenta de que está involucrado en una conspiración. Conforme más víctimas van siendo descubiertas, Reacher dedicará todas sus fuerzas a intentar demostrar su inocencia y a buscar respuestas a esa conspiración. Mientras el peligro aumenta, Reacher tendrá que echar mano de su experiencia e inteligencia para sortear las trampas que le irán tendiendo. Será una difícil misión, ya que esa conspiración mortal está plagada de policías corruptos, además de empresarios y políticos con turbias intenciones."
No disponible,https://es.web.img3.acsta.net/c_310_420/pictures/15/08/25/13/33/099067.jpg,"'Crimen en el paraíso' es una coproducción franco-británica rodada en Guadalupe creada por Robert Thorogood para la BBC. La serie narra los casos de un policía inglés en la isla caribeña de Saint-Marie. Richard Poole (Ben Miller, 'El príncipe y yo', 'Oscura seducción') es un policía inglés con un escaso sentido del humor y una gran determinación a la hora de resolver casos. Metódico, intuitivo y excesivamente cuidadoso a la hora de analizar las pruebas, su carácter antisocial y distante no son un inconveniente a la hora de ser un buen policía. Cuando viaja a la isla caribeña de Saint-Marie con el objetivo de resolver el asesinato de un compañero, no se imagina que su destino es convertirse en el nuevo Inspector Jefe de la localidad, a pesar de sus reticencias. Desde el primer momento Richard deberá lidiar con su nueva compañera, la decidida e independiente Camille (Sara Martins, 'Pequeñas mentiras sin importancia', 'Paris, je t´aime'), una policía de origen francés especializada en misiones encubiertas. También contará con la ayuda del joven detective Fidel Best (Gary Carr, 'Londres: Distrito Criminal') y la sargento Lily Thomson (Lenora Crichlow, 'Cacería', 'Being Human '). Con caracteres totalmente opuestos, las ideas de uno y otro no tardarán en chocar. Pero, si quieren acabar con el crimen en la paradisíaca isla, deben trabajar juntos."
No disponible,https://es.web.img3.acsta.net/c_310_420/pictures/14/04/01/12/14/467030.jpg,"'Justified' es un drama policíaco basado en las novelas 'Pronto' y 'Riding the rap' y en el cuento 'Fire in the hole', todos ellos de Elmore Leonard. Está ambientada en las montañas de Kentucky, Estados Unidos, y es Timothy Olyphant ('The office', 'Damages') quien da vida a Raylan Givens, protagonista de la serie. Raylan Givens es un oficial, 'chapado a la antigua' que abandonó Kentucky a la temprana edad de 19 años, decidido a no volver, y que ahora vive en Miami. Allí es donde trabaja y donde se toma la justicia por su cuenta pero, tras un desafortunado accidente en el que mata a un hombre en un acto más que justificado para él, se ve obligado a volver a su tierra natal. Es entonces cuando regresa al condado de Harlan, Kentucky, se tiene que enfrentar a todo tipo de criminales a pesar de seguir ejerciendo su profesión de la misma forma que lo hacía en Miami. En su regreso a su ciudad de origen se reencuentra con viejos conocidos como su padre, delincuente, Winona, su ex mujer, y un gran número de personas a las que hacía años que no veía y que han evolucionado de manera muy diferente."
No disponible,https://es.web.img2.acsta.net/c_310_420/pictures/21/07/01/14/21/0469400.jpg,"El Cartel de los Sapos: El origen es una serie thrillerque se ambienta en la Cali de los años 60 y 70 donde dos hermanos compaginan la familia con el amor y su ambición compartida: controlar el mercado de la droga de Colombia. Los hechos preceden a las exitosas series El Cartel 1 y El Cartel 2 y se encuentra basada en hechos reales. Los hermanos Villegas son las cabezas del temido Cartel de Cali, dos hombres que escalaron posiciones en el universo criminal gracias a su ingenio y astucia."
No disponible,https://es.web.img3.acsta.net/c_310_420/medias/nmedia/18/82/01/05/20042801.jpg,"Los creadores David Simon ('Treme', 'Generation Kill', 'Homicidio') y Ed Burns ('Generation Kill') son los creadrores de este drama policial que aborda la escena local del narcotráfico en la ciudad de Baltimore tanto desde la perspectiva de la policía como de los que están al otro lado de la ley. Muy aclamada por la crítica, la producción de HBO ha sido considerada como una de las mejores series de todos los tiempos."
No disponible,https://es.web.img3.acsta.net/c_310_420/pictures/15/02/20/10/30/426830.jpg,"Wayward Pines es un thriller de suspense basado en la novela de Blake Crouch 'Pines'. Escrita y dirigida por M. Night Shyamalan ('El Sexto Sentido'), hay quien la compara con la aclamada serie de los 90 'Twin Peaks'. Se centra en el agente Ethan Burke y su búsqueda  de otros dos agentes federales desaparecidos. El agente Ethan Burke (Matt Dillon, 'Algo Pasa con Mary'), uno de los mejores agentes secretos de Seattle, es trasladado al pueblo Wayward Pines para investigar la desaparición de los agentes federales Kate Hewson y Bill Evans. Hewson era, además, socia de Ethan y la conocía mejor que nadie, lo que casi provoca la ruptura del matrimonio del agente. Mientras lleva a cabo su investigación, sufre un accidente de tráfico. Tras despertarse y recordar todo lo ocurrido, descubre que su cartera, teléfono, identificación, entre otras cosas, ha desaparecido. Después del accidente, Theresa, su esposa, recibe una llamada en la que se le informa que su marido ha desaparecido y decide sumergirse en su búsqueda junto al hijo de ambos, Ben."
No disponible,https://es.web.img3.acsta.net/c_310_420/pictures/14/02/28/13/09/430561.jpg,"Tras el éxito abrumador de la receta usada por 'CSI: Las Vegas' era de esperar que tuviera lugar algún 'spin-off'. 'CSI: Miami' es la primera de estas secuelas y viene también de manos del creador de la serie original Anthony E. Zuiker, que esta vez forma equipo con la creadora Carol Mendelshon. La producción continúa a cargo de Jerry Bruckheimer ('Sin rastro', 'Pearl Harbor', 'Piratas del Caribe', 'Armageddon'). Esta vez, la serie nos sitúa en la costera ciudad de Miami, donde los crímenes no son escasos y la unidad científica de la policía de Miami Dade, usando las técnicas más avanzadas y el personal más cualificado, es la encargada de resolverlos. El cabecilla de la unidad de investigación es Horatio Caine (David Caruso, 'Michael Hayes'), con un alto sentido de la justicia y que no descansará hasta que los culpables paguen por sus actos. El resto de la unidad está compuesta por Calleigh Duquesne (Emily Procter, 'El ala oeste de la Casa Blanca') y Eric Delko (Adam Rodríguez, 'Felicity', 'Roswell'), entre otros. Al igual que su predecesora, la serie gira en torno a un determinado caso, normalmente de asesinato, que se inicia y resuelve en ese mismo episodio. La historia interna de los personajes, sus arcos de transformación y las relaciones entre ellos tienen algo más de peso que en la ficción original. Sin embargo, también hay que tener en cuenta que en 'CSI: Las Vegas' las historias de los personajes fueron cogiendo fuerza según avanzaban las temporadas -recordemos que 'CSI: Miami' comienza cuando la original ya está en su tercera temporada-."
