Title,Image URL,Description
Juego de ladrones 2: Pantera,https://es.web.img2.acsta.net/c_310_420/img/03/c9/03c90e248da974c4c1610be6b30851cc.jpg,"Donnie (O’Shea Jackson Jr.), un ladrón astuto y experimentado, ha decidido unirse a una organización que ha ganado notoriedad en el mundo del crimen: la tristemente célebre Panther Mafia. Esta organización es conocida por sus operaciones meticulosamente planificadas y su brutal eficiencia. Ahora, Donnie está inmerso en la planificación del mayor robo de diamantes de la historia en Europa, un golpe que promete ser tan audaz como lucrativo. Sin embargo, lo que Donnie no sabe es que Big Nick (Gerard Butler), un detective implacable y tenaz, ya está al tanto de sus movimientos. Big Nick ha estado siguiendo de cerca las actividades de la Panther Mafia y ha puesto su mirada en Donnie. Con una determinación férrea y una habilidad para anticipar los pasos de los criminales, Big Nick está decidido a frustrar los planes de Donnie y llevarlo ante la justicia. La persecución está en marcha, y ambos hombres están dispuestos a hacer lo que sea necesario para lograr sus objetivos."
Fuera de la ley,https://es.web.img3.acsta.net/c_310_420/img/8f/eb/8feb3145fe7a1719394d2fafaa9c37f5.jpg,"Will y Terry, dos policías de un tranquilo pueblo, descubren un millón de dólares, lo que desata el caos en la comunidad. La codicia de los excéntricos habitantes los lleva a tomar decisiones cada vez más peligrosas e ilegales, mientras los agentes luchan por manejar la situación. El pueblo, antes pacífico y tranquilo, se convierte en un hervidero de traiciones, malentendidos y caos desenfrenado. Entre giros inesperados y humor negro, la historia revela cómo la ambición desmedida puede desmoronar los cimientos de cualquier sociedad."
El asesino del calendario,https://es.web.img3.acsta.net/c_310_420/img/4e/b0/4eb048f819496436c981d5fdd0dde996.jpg,"El servicio de Jules (Sabin Tambrea) en la línea de acompañantes, un servicio de apoyo a las mujeres que quieren llegar sanas y salvas a casa, comienza como una tarde de sábado supuestamente tranquila. Sin embargo, todo cambia cuando recibe una llamada de Klara Vernet (Luise Heyer), una joven madre. Klara afirma que esa noche será asesinada por un conocido asesino de mujeres. Le ha dado un ultimátum: O mata a su marido Martin (Friedrich Mücke) o será asesinada esa misma noche. La desesperada huida de Klara del llamado asesino del calendario se convierte en una carrera contrarreloj. Jules, que está al otro lado de la línea telefónica, se convierte en su única esperanza de rescate, y no sólo del asesino. Porque incluso la fachada perfecta de Martin esconde un lado oscuro."
El padrino,https://es.web.img3.acsta.net/c_310_420/pictures/18/06/12/12/12/0117051.jpg?coixp=49&coiyp=27,"En el verano de 1945, se celebra la boda de Connie (Talia Shire) y Carlo Rizzi (Gianni Russo). Connie es la única hija de Don Vito Corleone (Marlon Brando), jefe de una de las familias que ejercen el mando de la Cosa Nostra en la ciudad de Nueva York. Don Vito además tiene otros tres hijos: su primogénito Sonny (James Caan), el endeble Fredo (John Cazale) y el más joven se todos, Michael (Al Pacino), un marine condecorado por su lucha en la Segunda Guerra Mundial que acaba de regresar a su hogar en Nueva York. Por designios de la fortuna, Michael terminará llevando la vida que no deseaba, tomando las riendas del negocio familiar, cambiando su moral y sus valores, para defender a toda costa a su familia."
Una historia del Bronx,https://es.web.img2.acsta.net/c_310_420/medias/nmedia/18/68/09/19/20373248.jpg,"Sonny (Chazz Palminteri) es un peligroso gángster del Bronx. En el mismo lugar vive Calogero (Lillo Brancato), un joven de 17 años que ve con sus propios ojos un sangriento tiroteo protagonizado por los hombres de Sonny. Desde ese momento, Sonny se erige como el amigo que Calogero siempre había deseado tener, lo que provoca la entrada del joven en el mundo de la mafia neoyorquina. Sin embargo, Lorenzo (Robert De Niro), padre de Calogero, no cree que ese mafioso sea la mejor compañía para su hijo. Aunque el niño apenas conoce el mundo en el que está metido su amigo Sonny, llegará el momento en el que tendrá que elegir el camino a seguir: o el camino honrado por el que su padre siempre ha peleado o el sendero criminal que ha conocido gracias a su amigo Sonny. Ópera prima de Robert de Niro que desde la primera secuencia recuerda al cine de su amigo Martin Scorsese. El filme lo protagonizaron el propio De Niro ('Uno de los nuestros'), Chazz Palminteri ('Legend'), Lillo Brancato ('Marea Roja'), Francis Capra ('El hada novata') y Joe Pesci ('Solo en casa')."
El fuego de la venganza,https://es.web.img2.acsta.net/c_310_420/medias/nmedia/18/68/08/99/20070877.jpg,"John Creasy (Denzel Washington) lleva una vida solitaria y malhumorada, en gran parte debido a su profesión como agente del gobierno y a sus continuos flirteos con el alcohol. Un día le ofrecen cambiar de aires y convertirse en el guardaespaldas de una niña que estaba amenazada de secuestro, Lupita Ramos. Los secuestros a menores en la Ciudad de México son muy frecuentes y este tipo de advertencias no suelen caer en saco roto. No obstante, John se muestra reticente a aceptar el empleo, siendo su animadversión hacia los niños, por considerarse incapaz de tratar con ellos, el argumento central de su negativa. Al final, y después de meditarlo, acepta proteger a Lupita. Al principio, la relación entre ellos es fría y cortante. La niña despierta cierto recelo hacia su protector y este está cada vez más arrepentido de haber accedido. Pero con el paso del tiempo ambos consiguen limar asperezas y crean una relación muy estrecha, casi parental. A John se le despiertan sentimientos que ni sospechaba que tenía y es por eso que, cuando finalmente secuestran a la niña, él se toma el caso como algo personal. No está salvando a un cliente, sino a la que siente como su hija, así que la venganza que se propone contra los raptores será despiadada."
Seven,https://es.web.img2.acsta.net/c_310_420/medias/nmedia/18/69/04/89/19757783.jpg,"Somerset es un veterano detective que se encuentra a punto de jubilarse y que conoce al joven policia Mills. Juntos deberán investigar el asesinato de un hombre obeso que ha sido atado y obligado a comer hasta la muerte. Los crímenes se suceden mientras los dos detectives muestran sus talantes opuestos, uno paciente y racional, y el joven más impetuoso. Pronto averiguan que los crímenes son obra de la misma persona, ya que ésta deja numerosas anotaciones procedentes de diversas lecturas que ha ido realizando de una serie de libros de temática religiosa. De este modo, Somerset y Mills no tardan mucho en descubrir que la serie de asesinatos está inspirada en los siete pecados capitales: cada uno de los muertos había incurrido en éste u otro pecado, y había sufrido un terrible castigo en consonancia. La pareja de detectives, pese a sus grandes diferencias, tendrá que trabajar duro para conseguir detener a un asesino fanático y meticuloso que siempre parece ir un paso por delante de ellos, pues los asesinatos no dejan de sucederse y la lista de pecados se va acortando dramáticamente."
The Order,https://es.web.img3.acsta.net/c_310_420/img/de/4d/de4d5888ded56af0595f812cc5fd4130.jpg,"En 1983, una serie de atracos a bancos cada vez más violentos, falsificaciones de moneda y atracos con furgones blindados infunden el miedo en las comunidades del noroeste del Pacífico. Mientras las fuerzas del orden desconcertadas buscan respuestas, el solitario agente del FBI Terry Husk (Jude Law), destinado en la tranquila ciudad de Coeur d'Alene (Idaho), se convence de que los crímenes no son obra de delincuentes tradicionales con motivaciones económicas, sino de un grupo de peligrosos terroristas autóctonos. Dirigida por el radical y carismático líder Bob Mathews (Nicholas Hoult), la hermandad silenciosa planea una guerra devastadora contra el gobierno estadounidense."
Sin Nombre,https://es.web.img2.acsta.net/c_310_420/medias/nmedia/18/72/09/61/19180957.jpg,"El destino de dos jóvenes con vidas muy diferentes se verá unido en una estación ferroviaria. Ellos son Casper (Edgar Flores) un adolescente mexicano, miembro de una banda de adolescentes llamada Mara Salvatrucha y Sayra, una joven hondureña que se dispone a viajar con su familia."
El Secreto de Sus Ojos,https://es.web.img2.acsta.net/c_310_420/medias/nmedia/18/72/09/92/19153236.jpg,"Benjamin Espósito (Ricardo Darín) se ha retirado recientemente de su cargo en el Juzgado de lo Penal. Con bastante tiempo libre, ahora se dedica a escribir un libro. Benjamin utiliza su experiencia para contar una historia trágica que ocurrió en 1974. En aquella época el Departamento de Justicia para el que trabajaba, fue designado para investigar la violación y posterior asesinato de una joven. Gracias a ello, Benjamin puede ponerse en contacto con Ricardo Morales (Pablo Rago), marido de la fallecida y a quien promete ayudar a encontrar al culpable. Para su labor de investigación, cuenta con la ayuda de su gran amigo, Pablo Sandoval (Guillermo Francella), y de su jefa, Irene Menéndez Hastings (Soledad Villamil). Benjamin acaba más involucrado de lo que creía en el relato."
El silencio de los corderos,https://es.web.img3.acsta.net/c_310_420/medias/nmedia/18/74/29/15/19757760.jpg,"Esta película de suspense nos lleva a vivir una terrorífica historia que comienza con una serie de asesinatos de unas adolescentes en Alabama. Clarisse (Jodie Foster), una joven policía con un currículum intachable, sigue la pista del criminal para poder localizarle. Para ello pide ayuda a Hannibal Lecter (Anthony Hopkins), un sádico psiquiatra que se encuentra encarcelado en una prisión de gran seguridad."
Ciudad de Dios,https://es.web.img2.acsta.net/c_310_420/medias/nmedia/18/68/09/00/20071863.jpg,"En una favela de Río de Janeiro, en los años sesenta, “Buscapé” es un niño negro, pobre, demasiado frágil para ser un delincuente, pero demasiado listo para contentarse con un trabajo mal pagado. Ha crecido en un entorno violento, pero intenta ver la realidad de otro modo, con los ojos de un artista. Sueña con convertirse en fotógrafo profesional.“Dadinho”, un niño de once años, se acaba de mudar a la Ciudad. Él, en cambio, desea convertirse en el mayor criminal de Río y comienza su aprendizaje haciendo pequeños trabajos para la mafia local. Admira a “Cabeleira” y a su banda, que asaltan los camiones y roban todo lo que pillan. “Cabeleira” le ofrece a “Dadinho” la ocasión de cometer un asesinato, que será el primero de una larga lista…"
Rosario Tijeras,https://es.web.img3.acsta.net/c_310_420/medias/nmedia/18/91/85/16/20166279.jpg,"Emilio es un hombre que nunca se implica con ninguna mujer, solo se limita a tener relaciones sexuales y Antonio es todo lo contrario, mucho más sensato y respetuoso. La vida de ambos cambia cuando conocen a Rosario una mujer que centra su vida en vengar la muerte de su hermano Jonhefe y en escapar de sus peligrosos enemigos del pasado."
Chacal,https://es.web.img3.acsta.net/c_310_420/pictures/14/05/06/10/56/094494.jpg,"Chacal es una francotirador de élite que se ha mantenido sin nombre e invisible para todos. Cuando el hermano del mafioso ruso, Murad Terek es asesinado por el FBI y la milicia rusa, encargarán a Chacal la muerte de los líderes de ambas organizaciones. Aterrorizado de esta amenaza, el FBI se ve obligado a liberar a un francotirador, considerado como el único que puede acabar con Chacal."
Venganza,https://es.web.img2.acsta.net/c_310_420/medias/nmedia/18/66/89/00/20198925.jpg,"La trama tiene como personaje principal a Bryan Mills, un individuo que ha estado dedicado a lo largo de muchos años a las fuerzas de seguridad de su país para investigar y resolver todos aquellos casos que requirieran a un auténtico especialista en este tipo de situaciones. Desde que se vio en la necesidad de abandonar su importante trabajo, con motivo de que ya no se encontraba en plenas condiciones para llevarlo a cabo, se ha dado cuenta de que su vida en el fondo carece del sentido que anteriormente completaban su profesión y su buena relación con sus compañeros. Sin embargo, todo cambiará por completo cuando se ve en la obligación de solucionar el que sin duda va a ser el quebradero de cabeza más preocupante que ha debido afrontar en toda su existencia. Se trata del secuestro de Kim, su hija, a quien un peligroso grupo procedente del este de Europa ha apresado con el objetivo de sobornar y manipular a sus seres queridos. La tensión irá aumentando con el desarrollo de la trama, mientras que el protagonista experimentará el terror en su propia piel al comprobar que los días de su primogénita pueden estar contados. ¿Será capaz de rescatarla de las garras de sus enemigos antes de que sea demasiado tarde?"
Juego de ladrones,https://es.web.img3.acsta.net/c_310_420/pictures/18/02/20/10/02/4203841.jpg,"Un grupo de ladrones de bancos de élite con formación militar planean un atraco en el Banco de la Reserva Federal de Los Ángeles. Se trata de su mayor robo hasta el momento y consiste en robar los 120 millones de dólares en efectivo que todos los días se sacan de la circulación. Los sigue de cerca Nick Flanagan (Gerard Butler), sheriff local de Los Ángeles, que ha estado siguiendo al equipo de ladrones y no se detendrá ante nada hasta verlos detenidos. Thriller de acción que supone el debut en la dirección de Christian Gudegast, guionista de Objetivo: Londres (2016). Gudegast escribe el guión junto a Paul Scheuring (Prisión Break). Sus actores protagonistas son Gerard Butler (Geostorm, Dioses de Egipto), Pablo Schreiber (American Gods, Orange Is the New Black), O'Shea Jackson Jr. (Ingrid Goes West, Straight Outta Compton), Sonya Balmores (Ballers, Beyond the Break), Evan Jones (Guardianes de la galaxia Vol. 2, Deuda de honor), Meadow Williams (Camino hacia el éxito, The Harvest) y el rapero 50 cent (Redención, Caza al asesino)."
La trama (Broken city),https://es.web.img3.acsta.net/c_310_420/pictures/14/06/20/13/05/062541.jpg,"El candidato a la alcaldía Nicholas Hostetler (Russell Crowe) no confía en su esposa. La sombra de la traición lo acosa a cada instante y, dispuesto a acabar con su incertidumbre, contrata a un ex policía de notable prestigio para que investigue una posible aventura de su mujer.  El policía a quien confía el caso ha dejado de ejercer desde hace algún tiempo y ahora se gana la vida como detective privado. Pero lo que no espera el agente es tener que dedicarse a desvelar engaños conyugales... Aunque lo que sí que estaba lejos de imaginar era el giro inesperado que daría el caso en el que se involucra.  Las sospechas del alcalde se corroboran y el amante de su esposa aparece muerto. Detrás de este asesinato hay todo un macabro complot político que amenaza al candidato político y que el detective tendrá que resolver. Allen Hughes ('El libro de Eli') es el encargado de dirigir el film. Delante de las cámaras contamos con la presencia de Russell Crowe ('Robin Hood'), Mark Wahlberg ('Contraband'), Catherine Zeta-Jones ('El último gran mago') o Barry Pepper ('Valor de ley')."
Contratiempo,https://es.web.img3.acsta.net/c_310_420/pictures/16/11/18/11/16/356441.jpg,"Adrián Doria (Mario Casas) es un exitoso empresario que es acusado de un asesinato, aunque él se declara inocente. Para defenderse, contrata los servicios de la mejor preparadora de testigos del país, Virginia Goodman (Ana Wagener), con quien trabaja una noche para encontrar un argumento que logre liberarle de la cárcel. Pero la aparición de un nuevo testigo de cargo hace peligrar su estrategia, viéndose obligados a recomponer las piezas de un puzle imposible con el tiempo en su contra. Oriol Paulo (El cuerpo) escribe y dirige este thriller protagonizado por Mario Casas (Toro, Palmeras en la nieve), Ana Wagener (A escondidas, El perfecto desconocido), José Coronado (El hombre de las mil caras, Murieron por encima de sus posibilidades) y Bárbara Lennie (Las furias, Magical Girl). El reparto lo completan nombres como Francesc Orella (Truman), Paco Tous (Fuga de cerebros 2), David Selvas (Celda 211) e Iñigo Gastesi (Lasa y Zabala)."
Eye for an Eye (Ojo por ojo),https://es.web.img3.acsta.net/c_310_420/pictures/14/06/27/11/14/179782.jpg,"Narra la historia de Karen, una mujer felizmente casada, madre de dos hijas, cuya vida es totalmente perfecta. Sin embargo, un día todo cambia cuando su casa es asaltada por un extraño que asesina cruelmente a una de sus hijas. A pesar de la evidencia de los hechos, es puesto en libertad, algo que no sienta nada bien a la familia y mucho menos a la propia Karen. En ese momento, la vida de Karen dará un vuelco de 180 grados y decidirá tomarse la justicia por su mano. Cueste lo que cueste. Película dirigida por John Schlesinger (Algo casi perfecto o La hija de Robert Poste), y cuyo elenco de protagonistas está compuesto por actores como Sally Field (Una rubia muy legal 2 o Cinco hermanos), Ed Harris (El show de Truman o Una mente maravillosa), Olivia Burnette (Rápida y mortal) y Alexandra Kyle (El sueño de mi vida)."
Legend,https://es.web.img2.acsta.net/c_310_420/pictures/15/10/28/08/33/281588.jpg,"Londres, entre la década de los años 50 y los 60, Ronald y Reginald Kray (Tom Hardy) son dos gángsters gemelos completamente idénticos que hacen del crimen su oficio. Conocidos como los 'Kray twins' fueron dos de los criminales más célebres de la historia de Gran Bretaña, y su imperio del crimen organizado se dedicó al asesinato, al robo y a la extorsión en el East End de Londres. A través de sus actividades delictivas y su falta de escrúpulos, la influencia de estos dos mafiosos parecía no tener límites en la capital inglesa. Pero los dos hermanos tienen una relación problemática, porque Reggie Kray, el mayor de los dos, trata de controlar las tendencias psicopáticas de su gemelo más joven. Aún así, consiguen ascender hasta lo más alto de la mafia. Sin embargo, cuando Frances Shea (Emily Browning), la esposa de Reggie, anima a su marido a alejarse de los negocios, la caída de los hermanos Kray parece inevitable. Basada en el libro The Profession of Violence de John Pearson, Legend cuenta la historia real de los conocidos como 'Kray twins', y está dirigida por Brian Helgeland (42, Destino de caballero, Payback). El actor que encarna a los idénticos hermanos gángsters es Tom Hardy (El renacido, Mad Max: Furia en la carretera, El caballero oscuro: La leyenda renace). El reparto lo completan Emily Browning (Pompeya, Summer in February) y Paul Anderson (En el corazón del mar, Peaky Blinders)."
Pulp Fiction,https://es.web.img3.acsta.net/c_310_420/img/05/66/05663f00b8b5df58b003aaf5c46ef8ad.jpg,"Jules Winnfield (Samuel L. Jackson, Jackie Brown) y Vincent Vega (John Travolta, Grease) son dos asesinos a sueldo que trabajan a las órdenes del temido gángster Marsellus Wallace (Ving Rhames, Amanecer de los muertos), quien les encarga la importante misión de recuperar su misterioso maletín, que ha sido robado. Ahí empezarán todos sus problemas. Los dos criminales son polos opuestos que deberán trabajar juntos para cumplir su cometido. De forma paralela, Vincent tendrá que hacerse cargo de Mia Wallace (Uma Thurman, Kill Bill), la peculiar novia de su jefe, a petición del mismo, mientras él pasa unos días fuera de la ciudad. Su compañero Jules le recomienda que vaya con cautela, pues la atractiva mujer le puede meter en problemas. Mientras, el boxeador Butch Coolidge (Bruce Willis, El sexto sentido) debe perder una importante pelea, pues ha sido sobornado por Wallace para participar en este combate amañado, y la pareja formada por Pumpkin/Ringo (Tim Roth, Reservoir Dogs) y Honey Bunny/Yolanda (Amanda Plummer, Mi vida sin mí) decidirá atracar un establecimiento debido a su lamentable situación laboral."
Redención,https://es.web.img2.acsta.net/c_310_420/pictures/14/04/10/09/42/212321.jpg,"Con Jason Statham (Los mercenarios 2, Safe) a la cabeza, la historia gira en torno a un ex soldado de las fuerzas especiales que ve como su vida da un giro brusco para terminar atrapado en un peligroso laberinto criminal en el centro de Londres. Acostumbrado a situaciones imposibles, este experto en armamento y en enfrentamientos cuerpo a cuerpo, deberá pelear a fondo para salir de la situación en la que se encuentra. Rodeado y perseguido, la conflictiva zona donde se encuentra requerirá de todos sus esfuerzos para escapar de la trampa mortal donde todo el mundo parece tener motivos suficientes para querer matarlo. Recordando sus entrenamientos y sus días en el ejército, pondrá a prueba su memoría y su capacidad de supervivencia con el único arma que conocen sus nuevos enemigos: la violencia y brutalidad de las calles. No podrá confiar en nadie cuando la lucha por escapar se convierta en una venaganza y un ajuste de cuentas personal en este thriller de acción y ritmos fréneticos."
Criminal,https://es.web.img3.acsta.net/c_310_420/pictures/16/03/22/10/23/369365.jpg,"Jericho Stewart (Kevin Costner) es un peligroso e impredecible criminal con un subdesarrollo cerebral que hace que sea el sujeto perfecto para convertirse en el primer humano que pruebe un nuevo tratamiento del Dr. Micah Franks (Tommy Lee Jones). Así, a Stewart le implantan las habilidades, secretos y recuerdos de un agente de la CIA muerto. Ahora tendrá que proteger estos conocimientos a toda costa mientras intenta finalizar con éxito la peligrosa misión. Criminal está dirigida por Ariel Vromen (Rx. Al límite del riesgo). Forman parte del reparto Kevin Costner (Jack Ryan: Operación sombra, El Hombre de Acero), Gary Oldman (El amanecer del planeta de los simios, Robocop), Tommy Lee Jones (Lincoln, Men In Black 3), Ryan Reynolds (The Captive, R. I. P. D. Departamento de policía mortal), Alice Eve (Star Trek: En la oscuridad, Men In Black 3), Gal Gadot (Fast & Furious 6, Batman v Superman: el Amanecer de la Justicia) y Antje Traue (El Hombre de Acero, Pandorum)."
Shooter: El tirador,https://es.web.img3.acsta.net/c_310_420/medias/nmedia/18/67/82/20/20056085.jpg,"Cuando el mejor amigo y compañero de Bobby Lee Swagger muere durante un combate, este decide retirarse del ejército. Se va a vivir a Arkansas a una casa en mitad del bosque con la única compañía de su novia y su perro para que nadie le moleste. Pero un día, recibe una visita inesperada: requieren su ayuda para evitar un ataque terrorista contra el actual presidente de los Estados Unidos. Desgraciadamente el asesinato se lleva a cabo, pero el que muere no es el presidente y Swagger es acusado como el culpable del crimen. Alguien le ha tendido una trampa y le ha utilizado como cabeza de turco. Intentará averiguar quién le ha metido en esta encerrona que ha provocado que toda la policía del país esté detrás de él. La película está dirigida por Antoine Fuqua y cuenta con un reparto formado por Mark Wahlberg, Michael Peña, Danny Glover, Kate Mara, Elias Koteas, Rhona Mitra, Jonathan Walker y Louis Ferreira, entre otros."
Instinto básico,https://es.web.img3.acsta.net/c_310_420/medias/nmedia/18/76/35/68/20432773.jpg,"La trama se centra en Catherine Tramell (Sharon Stone), una escritora de éxito bisexual que puede llegar a ser una asesina despiadada, al menos todo apunta a ello después de que Johnny Boz, antiguo cantante de rock y propietario de un club nocturno de San Francisco, aparezca brutalmente asesinado en su cama después de pasar la noche con ella. Todo el mundo cerca de Catherine muere, y el agente de policía Nick Curran (Michael Douglas) tiene que averiguar el por qué. En el proceso, este agente mantendrá intensas relaciones pasionales con Catherine y con la psiquiatra Beth Gardner (Jeanne Tripplehorn), su pareja. Mientras, los asesinatos en circunstancias parecidas al de Boz no paran de suceder. La reciente desintoxicación de Nick de las drogas y el alcohol le harán más vulnerable a los indudables encantos de la escritora. Thriller erótico estadounidense de 1992, dirigido por Paul Verhoeven (Starship Troopers, Elle) y protagonizado por Sharon Stone (Flores rotas) y Michael Douglas (Un día de furia, Los demonios de la noche)."
Infiltrados,https://es.web.img3.acsta.net/c_310_420/medias/nmedia/18/67/82/22/20026978.jpg,"Al sur de Boston la policía estatal lleva años luchando contra el crimen organizado. Billy Costigan (Leonardo DiCaprio, ‘Origen', ‘Atrápame si puedes’), un policía novato que ha crecido rodeado de crímenes, será el topo perfecto para infiltrarse en la mafia; no sólo ha sido entrenado para ello sino que ha permanecido en la cárcel un tiempo para aumentar su credibilidad. Su misión es ganarse la confianza del capo principal, Frank Costello (Jack Nicholson, 'Ahora o nunca', ‘Alguien voló sobre el nido del cuco’), y ayudar a la policía a desarticular el grupo mafioso.  Pero las cosas no serán tan fáciles. Colin Sullivan (Matt Damon, 'Un lugar para soñar', ‘El ultimátum de Bourne’), un policía que cuenta con un puesto importante en la Unidad Especial de Investigación, se interpondrá en su camino. Aunque parece el perfecto oficial, ha sido entrenado por Costello para infiltrarse dentro de la policía del estado de Massachusetts... Esta película dramática y de crimen norteamericana, ganadora del Oscar en la categoría de Mejor Película, ha sido dirigida por Martin Scorsese (‘Uno de los nuestros’)."
