Title,Image URL,Description
"Taxi, derrape total",https://es.web.img2.acsta.net/c_310_420/medias/nmedia/18/89/88/20/20071047.jpg,"Belle Williams (Queen Latifah) es una taxista descarada y respondona, que destaca por su velocidad para recorrer las calles ya que ha 'tuneado' su coche para ello, y que sueña con ganar, algún día, una carrera de coches. Considerada la conductora más rápida de todo Nueva York, en su camino se cruza con un policía un tanto torpe al volante, el detective Andy Washburn (Jimmy Fallon), que necesita la ayuda de Belle si quiere atrapar a una banda de ladronas de bancos que escapan de la autoridad a toda velocidad.  Esta película dirigida por el cineasta Tim story (Los 4 fantásticos y Silver Surfer, Hurricane Season) es una adaptación del exitoso film francés de 2004 del mismo título de Luc Besson (Arthur y la guerra de los mundos, El quinto elemento)."
Muerte en el Nilo,https://es.web.img3.acsta.net/c_310_420/pictures/21/12/22/12/12/1938897.jpg,"Una pareja de recién casados (a los que dan vida Gal Gadot y Armie Hammer) celebra su reciente compromiso en Egipto. Allí, alquilan un barco llamado Karnak con el que pretenden navegar junto a sus invitados por el Nilo hasta Abu Simbel. La travesía es todo fiesta y diversión, hasta que se comete un asesinato a bordo. Entonces, uno de los pasajeros de la nave, el célebre detective Hércules Poirot (Kenneth Branagh), deberá investigar la misteriosa muerte de una joven heredera sin explicación aparente. Pronto, comienzan a surgir odios y rencillas entre el aparentemente tranquilo grupo de amigos y el investigador empieza a percibir que nada es lo que parece en ese lugar. Secuela de Asesinato en el Orient Express (2017), dirigida -y protagonizada- de nuevo por Kenneth Branagh, que se encarga de adaptar la célebre novela de Agatha Christie."
El juramento,https://es.web.img2.acsta.net/c_310_420/medias/nmedia/18/74/24/00/20081955.jpg,"Jerry Black, detective de homicidios de Nevada, disfruta de sus últimas horas como policía antes de acudir a la fiesta ""sorpresa"" que le han organizado sus compañeros con motivo de su jubilación. Su equipo le regala un billete de avión para hacer realidad su sueño: ir a pescar a México. Al mismo tiempo, el cuerpo sin vida de una niña de ocho años es encontrado enterrado en plenas montañas de Nevada. Jerry, a pesar de los consejos de sus amigos de que ponga fin a su carrera, decide investigar el caso, pero primero ha de darle la trágica noticia a la familia de la niña. Los padres, entre lágrimas, le suplican que encuentre al culpable. Jerry les promete que dará con él. Aunque encarcelan al principal sospechoso, el detective está convencido de que el verdadero asesino sigue en libertad."
Nahir,https://es.web.img2.acsta.net/c_310_420/img/45/99/459929140cdfbf6dfea541dd84719963.jpg,"En el año 2018 se produjo uno de los crímenes más impactantes de la historia reciente de Argetina. Nahir Galarza, una joven de 19 años, fue acusada y condenada por asesinar a su novio, Fernando Pastorizzo, convirtiéndose así en la mujer más joven de la historia del país en ser sentenciada a cadena perpetua por sus crímenes. Sin embargo, la historia dará un giro muy importante cuando Nahir cambia por completo de versión para pasar la acusación a su padre, un oficial de la policía argentina, siendo él el auténtico asesino. Una acusación que el sistema de justicia local no se tomó en serio."
"Torrente, el brazo tonto de la ley",https://es.web.img2.acsta.net/c_310_420/medias/nmedia/18/70/17/46/20086489.jpg,"José Luis Torrente es un incompetente policía madrileño al que el destino va a dar la oportunidad de redimirse con la posibilidad de desarticular una red dedicada al tráfico de drogas, acompañado por una camarilla de necios y tarados. Torrente, poco amigo de la higiene y de la ética, es también un machista y xenófobo recalcitrante, nostálgico del franquismo. Pocos son los vicios en los que no incurre frecuencia. Entre sus aficiones más inocuas se encuentra su fervorosa admiración por el cantante El Fary y su condición de seguidor acérrimo del Atlético de Madrid. El policía convive con su padre, un anciano inválido, al que tiene abandonado. Este castizo antihéroe descubre por casualidad una organización mafiosa liderada por un delincuente llamado Mendoza, cuyos planes se dispone a desbaratar."
Keepers. El misterio del faro,https://es.web.img2.acsta.net/c_310_420/pictures/19/03/13/16/09/3638754.jpg,"Thomas (Peter Mullan), James (Gerard Butler) y Donald (Connor Swindells) son tres fareros que llegan al remoto faro de las islas Flannan. Allí comienza su rutina diaria sin muchas distracciones, marcada por la soledad y una naturaleza salvaje. Todo cambia cuando algo inesperado ocurre y comiencen a sucederse extraños e inquietantes eventos. La tranquilidad se verá entonces enturbiada y pronto se masticará la tragedia. Thriller psicológico de misterio que dirige Kristoffer Nyholm (Taboo) y cuyo guion corre a cargo de Celyn Jones (Set Fire to the Stars) y el debutante Joe Bone. Proganizan la película Gerard Butler (Juego de ladrones: El atraco perfecto), Peter Mullan (Mowgli: La leyenda de la selva) Connor Swindells (Sex Education) y Ólafur Darri Ólafsson (Animales fantásticos: Los crímenes de Grindelwald)."
The Score (Un golpe maestro),https://es.web.img3.acsta.net/c_310_420/pictures/14/03/18/11/51/349027.jpg,"La trama gira en torno al personaje de Nick Wells, el dueño de un club de jazz en Montreal, quien se ha visto inmerso siempre en una vida llena de ilegalidades. Debido a que se encuentra algo cansado después de sus muchos años de dedicación y profesionalidad invertida en el crimen, toma la decisión de retirarse para poder vivir junto a su pareja alejado de ese mundo de criminalidad, pudiendo así dedicarse única y exclusivamente a su club. Sin embargo, decide realizar un último trabajo que supondrá la culminación de su carrera. Su compañero Max le encarga robar un gran cetro de oro del siglo XVI, almacenado en el sótano de la Aduana de Montreal. A priori, el robo resulta prácticamente imposible, y para llevarlo a cabo, tendrá que contar con las personas más talentosas en el arte del crimen. De pronto se cruza en su camino un joven ladrón, Jackie Teller, lo que acaba suponiendo que Nick viole una de sus reglas más importantes: trabajar en solitario. Película protagonizada por tres de los considerados mejores actores de sus respectivas generaciones: Marlon Brando, Robert De Niro y Edward Norton."
Striptease,https://es.web.img3.acsta.net/c_310_420/pictures/14/03/13/10/31/580869.jpg,"La vida de Erin Grant (Demie Moore, 'Ghost' y ‘Si las paredes hablasen’) da un giro de 360 grados al perder su trabajo y divorciarse de su marido Darrell Grant, un ladrón de poca monta que le arrebata la custodia de su hija. En ese momento, debe empezar de cero y conseguir dinero rápido para hacer frente a los gastos judiciales que le devolverán la custodia. Madre soltera y exsecretaria del FBI, se ve obligada a emprender un camino totalmente diferente para recuperar a su hija: trabajar en un club de striptease como bailarina exótica. Pronto llama la atención del congresista americano David Dilbeck (Burt Reynolds, ‘Boogie Nights’ y ‘En el nombre del rey’) y en él, Erin ve la oportunidad de conseguir dinero fácil. Sin embargo, las cosas no salen como había planeado. Basada en la novela satírica de Carl Hiassen, ('Striptease', 1993), fue traspasada a la gran pantalla en 1996 por el director Andrew Bergman (‘It could happenned to you’). El reparto lo completan Armand Assante, Burt Reynolds y Robert Patrick."
Infiltrados en la universidad,https://es.web.img3.acsta.net/c_310_420/pictures/14/05/09/15/52/253319.jpg,"Secuela de la exitosa comedia de 2012, Infiltrados en clase, que vuelven a dirigir el dúo de directores formado por Phil Lord y Christopher Miller. Después de la exitosa operación contra el narcotráfico en un instituto, los oficiales Smitchd (Jonah Hill, El lobo de Wall Street) y Jenko (Channing Tatum, Jupiter Ascending) deben infiltrase, esta vez, en la Universidad. A pesar de que la relación entre ambos ha mejorado mucho cuando llegan al campus y Jenko encuentra a su alma gemela en el equipo de fútbol y Smitch se adentra en el teatro bohemio, parece que todo lo conseguido se empieza a derrumbar. Ambos deberán descubrir si realmente son dos niños de instituto creciditos que van a la Universidad, o si son capaces de mantener una relación madura como compañeros de equipo policial."
La sombra de la sospecha,https://es.web.img3.acsta.net/c_310_420/medias/nmedia/18/91/81/64/20164865.jpg,"Pete Garrison es un agente especial al servicio de la Casa Blanca que en numerosas ocasiones ha salvado la vida del presidente de los Estados Unidos y, por tanto, es uno de sus hombres de confianza, y más condecorados. Es un hombre experimentado, veterano e inflexible que siempre hace lo correcto. Un día descubre un escabroso secreto cuando pasa a encargarse de la protección de la Primera Dama. Ademas de ganarse la total enemistad de un poderoso e influyente agente del Servicio Secreto, David Breckinridge, Garrison se convierte de pronto en uno de los sospechosos de una conspiración que trata de acabar con la vida del presidente. Ahora, deberá servirse de todos sus conocimientos y habilidades para demostrar su inocencia, en una carrera a contrarreloj en la que tendrá que enfrentarse a sus propios compañeros."
Taxi Driver,https://es.web.img3.acsta.net/c_310_420/medias/nmedia/18/74/28/34/20234753.jpg,"La película narra la historia de Travis Bickle (Robert De Niro, 'Luces rojas') un ex militar que había combatido en la guerra de Vietnam. Ese hecho le provoca ansiedad y depresión haciéndole sentir rechazado socialmente. Al no poder conciliar el sueño decide trabajar como taxista por los barrios de Nueva York durante las noches. Brickle se siente atraido por Betsy (Cybill Shepherd, 'The Client List'), una bella mujer que trabaja muy de cerca con el senador Charles Pallantine, aspirante a presidente. Betsy le concede una cita para ir al cine pero al descubrir la aficción que Travis tiene por la pornografía, decide no volver a verle. Aturdido y asqueado por la delincuendia que ve por la noche, decide comprarse un arma y pasar a la acción, limpiando las calles de maleantes. Su primer objetivo es el gobernador al que intentará asesinar en plena campaña de elecciones. Tras su fracaso con Betsy, Travis conoce a Iris (Jodie Foster, 'La habitación del pánico'), una prostituta explotada por su chulo y a la que intentará convencer para que abandone esa vida."
Memento,https://es.web.img3.acsta.net/c_310_420/medias/nmedia/18/70/92/19/20080991.jpg,"Leonard Shelby es un ex agente de seguros que dedica su día a día a investigar la muerte de su mujer, asesinada a manos de una persona a la que Leonard no logra recordar. Mientras intentaba detener al criminal, sufrió un golpe en la cabeza que le dejó inconsciente. Al despertar, su memoria estaba dañada, sufría una extraña e incurable enfermedad que le impedía retener recuerdos a corto plazo. De esta forma, la última imagen que guarda en su cabeza es la de la muerte de su esposa, pues los nuevos recuerdos que acumula en su memoria desaparecen al despertar. A pesar de saber su nombre y todos los detalles de su pasado, ya no puede crear nuevos recuerdos. Para dar con el asesino de su esposa cuenta con la ayuda de una cámara instantánea y varias notas tatuadas por todo su cuerpo."
The Batman,https://es.web.img2.acsta.net/c_310_420/pictures/22/01/27/16/40/2914301.jpg,"Cada noche Bruce Wayne se enmascara en la identidad de Batman para sumergirse en las profundidades de Gotham City. En su lucha contra el crimen únicamente cuenta con el apoyo de Alfred Pennyworth y la ayuda del teniente James Gordon, dentro de una blindada red de corrupción policial. Un nuevo asesino pone la mirada en algunos de los ciudadanos de Gotham creando una serie de sádicas maquinaciones que, mediante un rastro de pistas en forma de rompecabezas, llevarán a Batman por un camino turbulento y despiadado.  En su viaje hacia la venganza, el Caballero Oscuro se topará con Selina Kyle -alias Catwoman-, Oswald Cobblepot -alias El Pingüino-, Carmine Falcone y Edward Nashton -alias Enigma. Entre sombras y luces, Batman deberá forjar alianzas con algunos de ellos para impartir la justicia y acabar con el abuso de poder que tanto asola a la ciudad de Gotham."
Uno de los nuestros,https://es.web.img3.acsta.net/c_310_420/medias/nmedia/18/67/70/14/20077949.jpg,"'Uno de los nuestros es una película basada en el libro de Nicholas Pileggi llamado ""Wiseguy"". Henry Hill, es un aspirante a mafioso que intenta abrirse camino junto a sus amigos, Jimmy Conway y Tommy De Vito, en la difícil jerarquía de la mafia. Para ello deben dar varios golpes, introduciéndose en negocios cada vez más peligrosos. Finalmente Henry termina en el programa de protección de testigos del FBI después de testificar en contra de sus antiguos socios."
Baby Driver,https://es.web.img2.acsta.net/c_310_420/pictures/17/05/12/14/55/272246.jpg,"Baby (Ansel Elgort) es un chico apasionado de la música y con cara de niño bueno que domina el volante como nadie antes lo ha hecho, pero su habilidad está en manos de Doc (Kevin Spacey), un jefe del crimen para quien trabaja. Cansado de ese estilo de vida y de cumplir las normas de este peligroso atracador, el joven decide cumplir una última misión antes de retirarse. Pero Doc no se lo va a poner fácil, y menos después de averiguar que Baby siente algo por una joven llamada Debora (Lily James). De esta forma, el talentoso conductor tendrá que luchar por su amor y su libertad. Baby Driver es una película dirigida por Edgar Wright (Scott Pilgrim contra el mundo, Arma fatal) y cuenta con un reparto formado por Ansel Elgort (Bajo la misma estrella, Hombres, mujeres & niños), Lily James (Cenicienta, Orgullo + prejuicio + zombies, serie Downton Abbey), Jamie Foxx (Asalto al poder, Un ciudadano ejemplar), Jon Hamm (El último hombre en la Tierra, serie Mad Men), Kevin Spacey (Ciudad sin ley, 21 Black Jack, serie House of Cards) y Eliza Gonzalez (From Dusk Till Dawn: The Series), entre otros."
Step up (Bailando),https://es.web.img3.acsta.net/c_310_420/pictures/14/03/13/10/11/381575.jpg,"La película se centra en la figura de Tyler Gage, un muchacho que lleva toda la vida en los barrios más problemáticos de la ciudad de Baltimore y no tiene esperanza en salir de ahí. Su vida empieza a cambiar cuando por cometer un delito menor tiene que hacer trabajos para la comunidad en la Escuela de Artes Maryland, una cuestión que sin duda marcará el devenir de los siguientes acontecimientos que se desarrollarán durante la trama. Es aquí donde conoce a Nora, una bailarina profesional que casualmente busca un compañero de baile para una importante prueba, por lo que trata de convencer al protagonista para que se convierta en su nuevo compañero. Viven en mundos opuestos y tendrán que superar esas diferencias juntos para convertirse en una pareja de baile excepcional, sobre todo teniendo en cuenta las aspiraciones que ambos pretenden llegar a conseguir en un futuro no muy lejano."
Puñales por la espalda,https://es.web.img3.acsta.net/c_310_420/pictures/19/10/28/17/07/1703422.jpg,"El renombrado novelista de misterio Harlan Thrombey (Christopher Plummer) invita a su extensa familia disfuncional a su mansión en su 85 cumpleaños con la esperanza de reunirlos a todos. Cuando es encontrado muerto en su mansión, el inquisitivo y cortés detective Benoit Blanc (Daniel Craig) es llamado para investigar. Muy pronto, todos en la familia se vuelven sospechosos."
Enemigos públicos,https://es.web.img2.acsta.net/c_310_420/pictures/15/11/03/09/37/090072.jpg,"Adaptación del libro de Brian Burrough Public Enemies: America’s Greatest Crime Wave and the Birth of the FBI, 1933-34 que gira en torno a la figura de John Dillinger (Johnny Depp, Piratas del Caribe), un icónico atracador de bancos de la época que llegó a convertirse en leyenda por sus trucos y su especial habilidad para escapar de la policía. Dillinger se convirtió durante la Gran Depresión en el principal objetivo del director del FBI J. Edgar Hoover (Billy Cudrup, Big Fish) quien encargó a su mejor hombre, Melvin Purvis (Christian Bale, El caballero oscuro), la difícil tarea de atrapar al famoso bandido. Aunque la vida criminal de Dillinger comienza con un pequeño robo en un supermercado, su estancia en la cárcel le pone en contacto con un grupo de presos con quienes consigue escapar de allí y formar una banda especializada en atracar bancos. A pesar de los constantes intentos de la policía, nada parece poder parar a Dillinger y sus chicos que además, gracias a su particular encanto y a su carácter atrevido, han conseguido hacerse con la simpatía de mucha gente."
El secreto de una obsesión,https://es.web.img2.acsta.net/c_310_420/pictures/16/03/03/09/59/015078.jpg,"Año 2002, la historia arranca poco después del ataque terrorista a las Torres Gemelas. Ray (Chiwetel Ejiofor) y Jess (Julia Roberts) son dos investigadores del FBI que trabajan en el departamento de antiterrorismo. Un día descubren un homicidio que cambiará el rumbo de sus vidas: la hija de Jess ha sido brutalmente asesinada. Trece años más tarde de este trágico incidente, todavía no han dado con el asesino. Marcado por la culpa y la obsesión, Ray obtiene una nueva pista sobre el caso, que le lleva a creer a que por fin podrá cerrarlo. Sin embargo no está preparado para las revelaciones de un terrible secreto que descubrirá. Este remake estadounidense de la película argentina El secreto de sus ojos (2009), está dirigido y escrito por Billy Ray (Capitán Phillips, Los juegos del hambre). Sus actores protagonistas son Julia Roberts (Agosto, Larry Crowne, nunca es tarde, La guerra de Charlie Wilson) y Chiwetel Ejiofor (Marte (The Martian), 12 años de esclavitud, American Gangster). Completan el reparto Nicole Kidman (Grace de Mónaco, Margot y la boda), Alfred Molina (Desierto rojo, An Education) y Dean Norris (Remember, Caza al asesino)."
El jugador,https://es.web.img2.acsta.net/c_310_420/pictures/14/12/03/15/22/422370.jpg,"Mark Wahlberg (El único superviviente) interpreta a un profesor de literatura de la universidad con un grave problema: le gusta demasiado apostar, tanto que se puede llegar a considerar una adicción. Debido a su ludopatía, el profesor ahora tiene muchas deudas que saldar, deudas que le conducen hacia una nuevas amistades para nada recomendables. El protagonista no sabe cómo pagar el dinero que debe y ya no tiene a quién acudir, por lo que se encamina a los bajos fondos de la ciudad en busca de una salida, pero allí no encontrará más que nuevos problemas. El reparto, encabezado por Wahlberg, cuenta con otros actores como Jessica Lange (In Secret), Brie Larson (Infiltrados en clase) y Leland Orser (Venganza: Conexión Estambul). El filme está dirigido por Rupert Wyatt, conocido por dirigir El origen del planeta de los simios (2011)."
Fuga de Alcatraz,https://es.web.img3.acsta.net/c_310_420/pictures/16/02/18/13/53/466511.jpg,"La película está ambientada en los años 60 en San Francisco. Frank Lee Morris (Clint Eastwood 'El bueno, el feo y el malo') es internado en Alcatraz, una cárcel de máxima seguridad, debido a su largo historial de fugas. Ha llegado a prisión por tráfico de drogas y atracar a mano armada, pero esta vez, el alcaide de la prisión (Patrick McGoohan), le recuerda que no podrá salir de allí, ya que es una cárcel inquebrantable que está situada en una isla rocosa en medio de la Bahía de San Francisco. Morris no tarda en hacerse amigo de otros presos, especialmente de Charlie Butts (Larry Hankin), que ocupa la celda contigua a la suya. Entre todos los reclusos, tratan de planificar un nuevo modo de fugarse de Alcatraz.  Todo un clásico dirigido por Don Siegel, autor de otros títulos míticos como 'Harry el sucio' o ‘La invasión de los ladrones de cuerpos’. La historia está basada en la vida real del presidiario Frank Morris."
El cuervo (The Crow),https://es.web.img3.acsta.net/c_310_420/img/58/76/5876d17bab2f3f9fa6207cda24fdb6ac.jpg,"Thriller sobrenatural de superhéroes y nueva versión de la película de 1994 The Crow que protagonizó el malogrado Brandon Lee, basada en la novela gráfica homónima de James O'Barr. La vida de Eric Draven (Bill Skarsgård) transcurre al lado de Shelly Webster (FKA Twigs), su pareja y su alma gemela de la que está perdidamente enamorado. Pero cuando Eric es testigo de su brutal asesinato, presenciando cómo unos desconocidos la asesinan a ella y también a él, todo dará un vuelco dramático e inesperado.   En un limbo entre la vida y la muerte, Eric regresa de entre los muertos. Ahora tiene un objetivo: cobrarse su sangrienta venganza, porque no va a descansar hasta vengar el asesinato de Shelly. Imbuido de poderes sobrenaturales, Eric puede resistir disparos, ráfagas de escopeta y puñaladas. El antihéroe emprende así un oscuro camino de violencia brutal para vengar la muerte de Shelly a manos de sus misteriosos asesinos. Y cuando los encuentre, va a matar a todos y cada uno de ellos. No es ira lo que siente, es amor, un amor inmortal."
Un golpe con estilo,https://es.web.img2.acsta.net/c_310_420/pictures/17/02/16/17/01/502588.jpg,"Willie (Morgan Freeman), Joe (Michael Caine) y Al (Alan Arkin) son tres amigos jubilados a los que el sistema les ha congelado su plan de pensiones. Desesperados porque no pueden pagar las facturas, están decididos a recuperar su dinero. Los tres ancianos deciden entonces arriesgarlo todo y embarcarse en un temerario plan que consiste en atracar al mismísimo banco que se quedó con su dinero. Remake del thriller Going in Style que dirigió Martin Brest en 1979, esta versión la dirige Zach Braff (Ojalá estuviera aquí, Algo en común) y cuenta con un guión escrito por Theodore Melfi (Figuras ocultas, St. Vincent). Los actores protagonistas son Morgan Freeman (Ben-Hur, Ahora me ves 2), Michael Caine (La juventud, Kingsman: Servicio secreto) y Alan Arkin (Navidades, ¿bien o en familia?, Argo). Completan el reparto Ann-Margret (Un domingo cualquiera), Matt Dillon (Wayward Pines) y Christopher Lloyd (Cyberchase)."
El golpe,https://es.web.img2.acsta.net/c_310_420/pictures/14/03/27/13/16/401621.jpg,"El golpe relata la historia de Henry Gondorff y Johnny Hooker, dos timadores que están decididos a vengar la muerte de un viejo y querido amigo que fue asesinado por un peligroso mafioso, Doyle Lonnegan. Éste asesinó al estafador por robarle una gran cantidad de dinero. Para matarle sin levantar sospechas, Henry y Johnny idean un plan basado en un golpe perfecto. Éstos y otros muchos timadores, amigos de los protagonistas, deciden unirse para vengar la muerte de su compañero a manos de uno de los gánsters más poderoso de toda la ciudad. Dirigida por el americano George Roy Hill (El mundo según Grap), la cinta ha conseguido que sea considerada como un clásico del cine y una de las películas mejor valoradas de todos los tiempos. Protagonizada por dos grandes de la gran pantalla, Paul Newman (Camino a la perdición) y Robert Redford (La conspiración), la película llegó a conseguir siete estatuillas de oro en el año 1974: Mejor Película, Mejor director, Mejor Guión, Mejor Dirección Artística y Mejor Vestuario. Además, obtuvo diez nominaciones más en los Oscar y una nominación en los Globos de Oro del año 1973. Además de los ya mencionados Robert Redford y Paul Newman, el reparto lo completan Robert Shaw, Charles Durning, Ray Waltson, Eileen Brennan, Harold Gould y Dana Elcar, entre otros."
Training Day (Día de entrenamiento),https://es.web.img2.acsta.net/c_310_420/medias/nmedia/18/71/71/43/20082048.jpg,"Jake Hoyt, un joven policía con buenas intenciones, cree haber conseguido al fin su ansiado objetivo: convertirse en detective sirviendo a Alonzo Harris, un agente de narcóticos con más de 13 años de experiencia. En un ambiente enturbiado por la delincuencia, el tráfico de drogas y los asesinatos a sangre fría, Hoyt tendrá que hacerse respetar siguiendo los pasos de su superior, un hombre cuyos métodos hacen tambalear la barrera entre la legalidad y la corrupción, algo que el joven policía parece no estar dispuesto a aceptar."
No disponible,https://es.web.img2.acsta.net/c_310_420/pictures/23/01/18/14/16/2286681.jpg,"Málaga, 2010. Durante la cabalgata de Reyes Magos, la pequeña Amaya Martín desaparece entre la multitud, sumiendo a su familia en una pesadilla. Miren, una periodista en prácticas, inicia una investigación paralela a la de la inspectora Millán, desenterrando un trauma de su pasado. Con el apoyo de Eduardo, un veterano periodista, Miren se obsesiona con hallar a la niña, adentrándose en un oscuro laberinto de secretos y mentiras."
