Title,Image URL,Description
No disponible,https://es.web.img3.acsta.net/c_310_420/pictures/15/07/29/14/33/086520.jpg,"'Narcos' es una serie de televisión desarrollada por Netflix que se centra en la historia real de una peligrosa difusión y propagación de una red de cocaína por todo el mundo durante los años 70 y 80. Mientras tanto, las fuerzas de seguridad harán frente a este brutal y sangrante conflicto. La serie está narrada en voz en 'off' desde el presente mientras te cuenta la batalla que hubo entre Escobar y el cartel de Medellín contra el gobierno colombiano respaldado por Washington. Esta ficción dramática sigue a uno de los capos de la cocaína más importante de Colombia, Pablo Escobar. Por otro lado, Javier Peña, agente de la DEA mexicana, es enviado a la localidad para capturar al peligroso líder y aniquilarlo. La serie está protagonizada por Wagner Moura, Pedro Pascal, Boyd Holdbrook, Manolo Cardona y Juan Pablo Raba, entre otros. Producida por Gaumont International Television en conjunto con Netflix y escrita por Chris Brancato, 'Narcos' cuenta con Eric Newman y José Padilha como productores ejecutivos y éste último también como director."
No disponible,https://es.web.img3.acsta.net/c_310_420/pictures/21/04/07/11/14/5145026.jpg,"ACI: Alta Capacidad Intelectual es una serie crimen comedia que sigue la historia de Morgane Alvaro, una madre soltera con tres hijos de dos padres diferentes que nació con alto potencial intelectual. Es mentalmente superior a muchas personas pero socialmente es muy torpe. La única persona con la que se lleva bien es su vecino Henri de 75 años. Una noche, mientras trabajaba como empleada de la limpieza en una comisaría de policía, 'ordena' unos elementos de una pizarra de investigación haciendo que puedan encontrar al sospechoso más rápido de lo que creían en un principio. Por lo que deciden contratarla para ayudarles a rastrear y resolver los casos más difíciles."
No disponible,https://es.web.img3.acsta.net/c_310_420/pictures/22/06/02/22/52/4008872.jpg,"Después de perder su pierna por culpa de una mina terrestre en Afganistán, Cormoran Strike se encuentra sobreviviendo a duras penas como investigador privado. Además, acaba de romper con su novia de muchos años y está viviendo en su oficina.  Un día John Bristow cruza su puerta con una historia sorprendente: Su hermana, la legendaria supermodelo Lula Landry, conocida por sus amigos como Cuco, apareció muerta meses atrás. La policía ha descartado el suicidio, pero John se rehúsa a creer eso. El caso sumerge a Strike en un mundo de multimillonarios, novios de estrellas de rock and roll y diseñadores desesperados, además de introducirlo a todas las variedades de placer, seducción y engaño conocidos por el hombre. The Cormoran Strike Mysteries es una serie de televisión detectivesca basada en la serie de novelas escrita por la aclamada autora de Harry Potter, J. K. Rowling, bajo el seudónimo de Robert Galbraith. Esta serie de novelas está compuesta por los libros El canto del cuco, El gusano de seda y Carrera de maldad. La adaptación televisiva de estas novelas cuenta con un guión escrito por Sarah Phelps, y es producida por la BBC en colaboración con HBO. Esta es la segunda colaboración entre ambas cadenas, quienes colaboraron en la adaptación de otra obra de Rowling, Una vacante imprevista. Julian Farino (Ballers, La hija de mi mejor amigo) es el director de esta serie británica."
No disponible,https://es.web.img3.acsta.net/c_310_420/pictures/13/12/04/17/21/233473.jpg,"Aclamado drama muy a la americana creado por Kurt Sutter ('The Shield'), que se colocó rápidamente en lo más alto de la cadena FX en lo que a series de ficción se refiere. Narra las aventuras de los Hijos de la Anarquía, una banda de moteros con su propio código de moral a los que no les importa cometer actos criminales y atroces con tal de su subsistencia. La serie se centra en la sede original de los Hijos de la Anarquía, los Redwood Original, fundadores de la banda, con base actual en Charming, California. El protagonista es Jackson 'Jax' Teller (Charlie Hunnam, 'Queer As Folk', 'Hooligans'), vicepresidente de la banda, hijo de uno de los difuntos fundadores de la banda y adoptado por Clay Morrow (Ron Perlman, 'Hellboy', 'Drive'), co-fundador de la banda que se casó con la madre de Jax, Gemma Teller (Katey Sagal, 'No con mis hijas', 'Perdidos') tras esta quedarse esta viuda. Esta asociación para amantes de las dos ruedas es mucho más que un simple club de moteros. Su actividad delictiva ha ido 'in crescendo' desde su nacimiento y las sedes se han ido extendiendo hasta contar con miembros alrededor de todo el globo. Sin embargo, tras el incendio de uno de sus almacenes, Jax empieza a rechazar la idea de sus actividades criminales, de su pertenencia a la banda, e incluso de su simple existencia."
No disponible,https://es.web.img2.acsta.net/c_310_420/pictures/17/07/19/14/29/555036.jpg?coixp=50&coiyp=37,"La historia de Lucifer es la que todos conocemos: un ángel caído del cielo. Sin embargo, este señor del infierno está aburrido de su propia existencia. Por ello, Lucifer decide abandonar su reino e ir a la ciudad de Los Ángeles a descubrir qué puede ofrecerle el mundo mortal. En su búsqueda de ""qué hacer con su tiempo"" decide abrir un distinguido club nocturno, llamado Lux, y se dedica a disfrutar de sus cosas favoritas: el vino, las mujeres y la música. Sin embargo, su apacible vida se ve alterada cuando una mujer es brutalmente asesinada cerca de su club. De repente, siente que debe hacerse justicia y por ello comienza a ayudar a la policía a intentar resolver diversos casos de homicidios, convirtiéndose así en una especie de colaborador."
No disponible,https://es.web.img3.acsta.net/c_310_420/pictures/15/10/12/14/18/321118.jpg,"Esta producción de los creadores David Lynch ('El hombre elefante', 'Inland Empire') y Mark Frost ('Canción triste de Hill Street') gozó de un éxito extraordinario a principios de la década de los noventa. La serie nos brinda un drama policíaco donde la investigación y lo sobrenatural van de la mano y en el que hasta pueden apreciarse pinceladas de humor surrealista. Se traslada al espectador a la apacible localidad de Twin Peaks sacudida por la repentina muerte de la bella y popular Laura Palmer (Sheryl Lee, 'Sexy Money', 'One Tree Hill'), que es encontrada desnuda y envuelta en plásticos en un lago. Por esta razón, el Agente Especial del FBI Dale Cooper (Kyle MacLachlan, 'Mujeres desesperadas', 'Sexo en Nueva York') es enviado al pequeño pueblo en aras de esclarecer el asunto. Cooper, convencido de la conexión de este asesinato con otro ocurrido en las mismas fechas el año anterior inicia una investigación en la que trabaja codo con codo junto al Sheriff local Harry Truman (Michael Ontkean, 'Los descendientes'). Sus hallazgos no solo arrojan algo de luz sobre el asesinato de Laura Palmer, sino que traen a colación los más sórdidos asuntos de los habitantes de este, definitivamente, no tan tranquilo lugar."
No disponible,https://es.web.img3.acsta.net/c_310_420/pictures/20/09/21/15/12/3528777.jpg,"La serie Fargo es una comedia dramática de thriller y suspense, inspirada en el peculiar universo creado por los hermanos Coen en su película homónima de 1996. Esta antología la componen varias temporadas con tramas independientes y autoconclusivas, todas ellas con un universo compartido y ambientadas en la Minnesota profunda. Son historias que, de una u otra forma, nos llevan siempre a Fargo, Dakota del Norte.  La mediocre vida de Lester Nygaard da un vuelco cuando un inquietante hombre llamado Lorne Malvo llega a la ciudad. Este hombre desarraigado y manipulador sembrará tras de sí un sendero de violencia que transformará por completo la hasta ahora apacible vida de sus habitantes. En 1979, el agente de policía Lou Solverson investiga un tiroteo ocurrido en una cafetería que involucra a un matrimonio de la localidad, además de a los Gerhardt, una familia de criminales de Dakota del Norte. Por su parte, a finales del año 2010, la rivalidad entre Emmit y Ray Stussy, dos hermanos antagónicos, uno un triunfador y el otro siempre al borde de la bancarrota, desembocará en un camino tortuoso con asesinatos y relaciones con la mafia. En el año 1950, en Kansas City, dos clanes mafiosos enfrentados, uno italiano y el otro afroamericano, acuerdan mantener una paz incómoda pero provechosa. Esta tregua en seguida peligrará cuando, por diversos giros fortuitos del destino, surjan ansias de venganza entre los miembros de los dos sindicatos criminales. Año 2019. Roy Tillman, sheriff de Dakota del Norte, lleva mucho tiempo buscando a Dorothy 'Dot' Lyon, una típica ama de casa del Medio Oeste que esconde más de lo que parece. Mientras ella intenta proteger a toda costa a su familia, el sheriff Tillman estará siempre al acecho."
No disponible,https://es.web.img3.acsta.net/c_310_420/pictures/18/07/02/14/12/5660762.jpg,"Ambientada en 2002, seis años antes de los acontecimientos relatadas en Breaking Bad, Better Call Saul es un spin-off centrado en el personaje de James 'Jimmy' McGuill (Bob Odenkirk), antes de que asuma la identidad de Saul Goodman, un abogado corrupto con un humor políticamente incorrecto vinculado al mundo criminal que empieza a crear una importante red de contactos en los bajos mundos. La serie narra los acontecimientos que llevan a McGuill a convertirse en Saul antes de trabajar con Walter White (Bryan Cranston), más conocido como Heisenberg, el narcotraficante más temido de Nuevo México. A McGuill le acompañan su hermano Chuck (Michael McKean), también abogado y máximo referente de éxito para Jimmy; Kim Wexler (Rhea Seehorn), una vieja amiga del protagonista; y Mike Ehrmantraut (Jonathan Banks), policía retirado que trabaja formalmente como investigador privado, pero que en realidad es una tapadera para su labor como el hombre que resuelve los problemas de McGuill, a menudo con métodos violentos."
No disponible,https://es.web.img2.acsta.net/c_310_420/pictures/18/10/18/16/10/4844700.jpg,"Narcos: México es una serie original de Netflix que sigue la línea de la ficción Narcos. Esta nueva entrega repasa la historia del narcotráfico mexicano desde los años 80, cuando surgió el Cártel de Guadalajara. Además, explora los origines de la guerra moderna contra las drogas. La trama gira en torno a Miguel Ángel Félix Gallardo (Diego Luna), líder del cártel y creador del narcotráfico mexicano actual, y Kiki Cameron (Michael Peña) que es un agente encubierto de la DEA y hombre de familia. La serie, producida por Gaumont Télevision junto a Netflix, está creada por Eric Newman (Narcos). Además, es productor junto a José Padilha (Narcos), Doug Miro (Narcos) y Carlo Bernard (Narcos). El reparto de protagonistas se compone de Michael Peña (Gracepoint), Diego Luna (Mister Lonely), Tenoch Huerta (Mozart in the Jungle), José María Yazpiz (Narcos) o Joaquín Cosío (The strain), entre otros."
No disponible,https://es.web.img3.acsta.net/c_310_420/pictures/14/02/17/11/13/171605.jpg,"Esta serie de éxito de la casa Fox, creada por Hart Hanson ('Joan of Arcadia') y basada en la figura de Kathy Reichs, antropóloga forense y escritora de novelas de misterio, nos presenta la historia de la Dra. Temperance Brennan (Emily Deschanel, 'El álamo, la leyenda'), quien sería la representación de Reichs en la serie y protagonista de la misma. Como una de las profesionales más cualificadas en su campo, la Dra. Brennan trabaja en el departamento de ciencias forenses del Instituto Jeffersonian de Washington D.C. examinando restos de cadáveres. Su gran dominio de la antropología la permite reconstruir cómo vivieron y murieron personas fallecidas cuando los restos encontrados son mínimos, incluso cuando estos se limitan a huesos. Es por eso que, cuando el FBI se enfrenta a casos en los que métodos tradicionales de identificación de cadáveres no son suficientes, recurren a la Dra. Brennan para esclarecer los hechos. Esta coolaboración con el FBI pondrá junto a nuestra protagonista al Agente Especial Seeley Booth (David Boreanaz, 'Buffy la cazavampiros', 'Ángel'), un francotirador atormentado por los fantasmas de su pasado. La serie no sólo se concentra en los casos que se investigan en cada episodio, sino también en la trama interna de cada personaje y las relaciones entre ellos. Los puntos de vista dicotómicos que tienen los protagonistas en lo que se refiere a ciencia y fe junto a la poderosa química y tensión sexual que existe entre ellos serán el perfecto caldo de cultivo de su relación como compañeros de trabajo."
No disponible,https://es.web.img3.acsta.net/c_310_420/pictures/18/09/24/09/30/5792474.jpg,"La trama de Vivir sin permiso se desarrolla en Galicia y se centra en la historia de Nemesio ‘Nemo’ Bandeira, un hombre que siempre estuvo ligado a las actividades del narcotráfico gallego. Ahora, Nemo ha conseguido blanquear su historial y es uno de los empresarios más importantes de la provincia. Pero su bienestar se trunca cuando le detectan la enfermedad del Alzheimer. El empresario lo intenta ocultar a toda costa mientras pone en marcha la elección de su sucesor. Es aquí cuando sus dos hijos legítimos comienzan una lucha de poder para demostrar quién es el mejor para hacerse con la herencia de su padre. Por otra parte, su ahijado Mario Mendoza, un brillante abogado, es a priori el más preparado, pero Nemo tiene un conflicto moral y es que no es de su sangre. Este, que ansía esa herencia, usa su atractivo y buena planta en un plan que le lleva a convertirse en el peor enemigo."
No disponible,https://es.web.img3.acsta.net/c_310_420/pictures/18/10/01/04/34/4076746.jpg,"Una joven madre ha cometido un horrible acto de violencia que nadie puede explicar, ni siquiera ella misma. Llevaba una vida completamente normal y era una mujer modelo hasta ese mismo instante en que tuvo el extraño ataque de rabia. Decide buscar ayuda y así conoce a un investigador que está obsesionado con saber qué la ha pasado. Juntos, se embarcan en un largo y oscuro viaje a través de la psique humana que sacará a la luz los secretos más profundos de la protagonista. Protagonizada por Jessica Biel (El ilusionista, La matanza de Texas) y Bill Pullman (Independence Day), la serie cuenta con los actores Christopher Abbott, Abby Miller, Teri Wyble, Patti D'Arbanville, Dohn Norwood y Eric Todd. La serie está basada en el libro homónimo escrito por Petra Hammesfahr, que participa en el guion junto a Derek Simods. Antonio Campos es el director del episodio piloto de esta serie de USA de Universal Cable Productions que está producida por Jessica Biel, Antonio Campos, Derek Simonds, Charlie Gogolak y Michelle Purple."
No disponible,https://es.web.img3.acsta.net/c_310_420/pictures/210/051/21005165_20130808113654378.jpg,"Durante décadas, el ex agente de gobierno Raymond 'Red' Reddington (James Spader) ha sido uno de los fugitivos más buscados por el FBI. Haciendo de intermediario en negocios oscuros, 'Red' es conocido por muchos como 'el conserje de la delincuencia'. Red era miembro de los servicios de información del ejército. Dejó de prestar su servicio para convertirse en  uno de los terroristas más buscados de Estados Unidos que, de forma misteriosa, ha decidido rendirse y entregarse a las autoridades. Tras esto, decide hacer al FBI una oferta un tanto enigmática: ayudar a atrapar al desaparecido terrorista Ranko Zamani, bajo la condición de hablar sólo con la agente Elisabeth Keen. Red aparentemente no tiene ningún tipo de relación con Keen, que desde entonces es la encargada de vigiliar al rendido criminal. La agente cuenta con el apoyo de su marido Tom, quien consigue mantener la pareja con vida pero que la engañó unos años atrás en secreto."
No disponible,https://es.web.img3.acsta.net/c_310_420/pictures/14/03/26/09/23/414982.jpg,"Serie policíaca que sigue a un pequeño grupo especial de la policía estatal de Hawaii, y sus intentos por investigar y evitar crímenes graves en las islas. El hijo del detective Steve McGarrett Jr., Steve (Alex O'Loughlin, 'El plan B', 'Three Rivers') , ex-marine, regresa a su tierra natal tras años de ausencia. Sin embargo, no se trata de una visita por placer, sino a raíz de una terrible noticia: su padre ha sido asesinado. Decidido a investigar la muerte de su padre y a llevar ante la justicia a los responsables, Steve deja atrás su antigua vida para comenzar una nueva en las paradisíacas islas. Una vez allí, recibirá una oferta por parte de la gobernadora: unirse a la policía estatal, formando una unidad especial para investigar los crímenes más complicados que se producen en el día a día de Hawaii. De esta forma, Steve se pone al frente de un grupo conocid como 5-0, el cual perseguirá a los peores criminales de todas las islas sin tener que atarse a las restricciones burocráticas que limitan a la policía común. El grupo estará formado también Danny Williams (Scott Caan, 'El séquito'), un detective de Nueva Jersey trasladado recientemente, Chin Ho Kelly (Daniel Dae Kim, 'Perdidos'), un antiguo compañero de la escuela de Steve, y la prima de éste, Kono (Grace Park, 'The Cleaner')."
No disponible,https://es.web.img2.acsta.net/c_310_420/pictures/14/01/17/16/26/567517.jpg,"Drama policíaco que, producido por Mitchell Burgess ('Los Soprano') y Robin Green ('Los Soprano', 'Doctor en Alaska'), cuenta la historia de los Reagan, una familia gaélico-americana de agentes con una amplia presencia en el Departamento de policía de Nueva York. Frank Reagan (Tom Selleck, 'Las Vegas', 'Boston Legal', 'Friends) es jefe de policía y patriarca de la familia, a la que maneja con la misma diplomacia con que lo hace en el trabajo. Sus hijos mayores son Danny (Donnie Wahlberg, 'Band of Brothers'), un experimentado detective, hombre de familia y veterano de guerra, que no dudará en utilizar técnicas de dudosa legalidad para cerrar sus casos. Le sigue Erin (Bridget Moynahan, 'Sexo en Nueva York'), una fiscal que sirve de equilibrio entre su padre y hermano. Por otro lado, la vida del hijo menor, Jamie Reagan (Will Estes, 'Siete en el paraíso') da un giro inesperado cuando este es invitado a convertirse en parte del equipo clandestino de la policía del que su padre no sabe nada, algo que podría afectar el legado de los Reagan."
No disponible,https://es.web.img3.acsta.net/c_310_420/pictures/23/08/09/11/31/0381475.jpg,"Tracker es una serie de crimen y drama que sigue la historia de Colter Shaw, un lobo solitario superviviente. Colter recorre el país en su autocaravana de la vieja escuela actuando como cazarrecompensas, ayudando a la policía y a ciudadanos particulares a resolver crímenes y localizar a personas desaparecidas. Mientras intenta equilibrar la resolución de misterios con mantener a su rota familia, un nuevo caso cambiará por completo la vida del cazador de recompensas."
No disponible,https://es.web.img3.acsta.net/c_310_420/pictures/21/06/23/09/50/3373320.jpg,"Only Murders in the Building, Solos asesinatos en el edificio en España, es una serie comedia que sigue principalmente a tres desconocidos que comparten una gran obsesión en común: el crimen. Pero al ser solo unos aficionados a él, sus vidas cambiarán radicalmente cuando se vean envueltos en uno de verdad. Cuando se produce un escalofriante asesinato en un apartamento de Upper West Side, estas tres personas emplean sus conocimientos sobre crímenes para resolver el crimen. Para ello comienzan a grabar un podcast para documental el caso donde desentrañan los complejos secretos del edificio años atrás."
No disponible,https://es.web.img3.acsta.net/c_310_420/pictures/23/10/03/11/36/2597729.jpg,"Found es una serie dramática de género criminal y misterio que nos presenta a Gabi Mosley, una mujer especialista en encontrar a personas desaparecidas. En un año cualquiera, en Estados Unidos, más de 600.000 personas son reportadas como desaparecidas, y más de la mitad de ellas son personas racializadas de las que el sistema parece olvidarse. El equipo de gestión de crisis que lidera Gabi Mosely se asegura de encontrar a las personas desaparecidas olvidadas y que el sistema ha pasado por alto. Su equipo está formado por expertos que fueron o conocieron a personas secuestradas. La propia Gabi fue víctima de un secuestro cuando era niña. Pero ese escalofriante secreto tendrá sus consecuencias."
No disponible,https://es.web.img3.acsta.net/c_310_420/medias/nmedia/18/97/19/75/20514656.jpg,"Candice Renoir sigue a esta detective de policía, una mujer divorciada con cuatro hijos que decide dar un parón a su vida durante diez años. Cuando regresa al Sur de Francia para volver a retomar su servicio, esta se da cuenta de que el trabajo ha evolucionado y se siente un poco oxidada. Pero Candice, toda una bomba explosiva, decide enfrentarse a sus debilidades resolviendo los casos más complejos, pese a los obstáculos de la nueva unidad y su jefe."
No disponible,https://es.web.img3.acsta.net/c_310_420/img/71/2f/712fb19c9e320acd231cb1254c4eab20.jpg,"Se muestran vidas personales y profesionales de un equipo de policías antidisturbios en Roma y cómo las tensiones internas y el odio latente entre los miembros del grupo afectan sus relaciones y decisiones. Mientras enfrentan los desafíos de su labor, sus vidas se desmoronan poco a poco, revelando los conflictos y frustraciones que los consumen. La historia es un retrato intenso de las complejidades emocionales y morales que surgen en un ambiente de alta presión."
No disponible,https://es.web.img3.acsta.net/c_310_420/pictures/18/08/28/11/33/0160515.jpg,"FBI explora las experiencias de los agentes de este cuerpo de la ley en Nueva York. En esta ficción, el agente OA se traslada de Bushwick a West Point con la suficiente confianza en sí mismo y la voluntad de llevar a cabo su trabajo de la manera más implicada posible. OA es un joven que siempre ha tenido que luchar duro para alcanzar sus metas, sobre todo al infiltrarse durante años en el entorno de la droga para desmantelar una organización. Al finalizar esta operación, el agente, que entonces pertenecía a la DEA, abandona el grupo y es reclutado y elogiado por el FBI. Zeeko Zaki (Six, 24: Legacy) protagoniza esta ficción de la cadena CBS creada por Dick Wolf (Ley y Orden)."
No disponible,https://es.web.img3.acsta.net/c_310_420/pictures/22/05/05/15/36/3670053.jpg,"Rapa es una serie thriller que se ambienta en la zona rural de A Capelada de Galicia, un lugar de altos acantilados sobre el mar donde los caballos viven libres menos un día, el de la rapa das bestas, una tradición que sintetiza lo bello y lo salvaje de un territorio por lo general tranquila. Sin embargo, ese mismo día en el que se celebra tal día se convierte en escenario de un crimen, el asesinato de Amparo Seoane, la alcaldesa de la localidad. Tomás, un profesor frustrado, y Maite, una sargento de la guardia civil, se encargarán de buscar a su asesino."
No disponible,https://es.web.img3.acsta.net/c_310_420/pictures/19/08/20/09/43/1428134.jpg,"En el barrio de Harlem (Nueva York), en la década de los 60, Bumpy Johnson es el jefe de la mafia y mentor de Frank Lucas -personaje de American Gangster-. La serie trata de los entresijos del mundo criminal y del movimiento por los derechos civiles. De esta manera, su creador busca comprender la época actual echando un vistazo al pasado. La ficción es una precuela de la cinta American Gangster, de Ridley Scott. Chris Brancato (Narcos) es su creador y productor, mientras que Forest Whitaker (Rogue One: una historia de Star Wars) protagoniza este proyecto."
No disponible,https://es.web.img3.acsta.net/c_310_420/pictures/14/02/24/12/48/407211.jpg,"El 'spin-off' situado en la ciudad de Los Ángeles de la franquicia 'Navy' es un drama sobre el arriesgado mundo que rodea a la división NCIS, encargada de dar caza a peligrosos y escurridizos criminales que suponen una amenaza para la seguridad nacional. Adoptando falsas identidades y utilizando la tecnología más avanzada, los miembros de este equipo de elite se infiltrarán de lleno en el ojo del huracán y pondrán en riesgo sus vidas para atrapar a sus objetivos. El agente especial G. Callen (Chris O'Donnell, 'Esencia de mujer', 'Batman Forever', 'Batman y Robin') es todo un camaleón que puede convertirse en quien sea necesario para trabajar en operaciones encubiertas. Su compañero, el agente especial Sam Hanna (LL Cool J, 'In the House') es un antiguo marine que ha vivido la acción en primera persona en las guerras de Afganistán e Irak. Asistiendo al equipo está la omnisciente Hetty Lange (Linda Hunt, 'Sin rastro'), supervisora y proveedora de toda la tecnología que el equipo pueda necesitar. La agente especial Kensy Blye (Daniela Ruah) es la hija de un marine asesinado y amante de la adrenalina que su trabajo le produce. Para terminar, tenemos a Marty Deeks (Eric Christian Olsen, 'Community', 'Cinco hermanos'), agente del cuerpo de policía de Los Ángeles reclutado para el equipo; Eric Beale (Barrett Foa, 'El séquito'), experto en tecnología, y la analista de inteligencia Nell Jones (Renée Felice Smith), que se ganó el respeto con su enorme poder de deducción. Armados con lo último en tecnología y equipamiento, el Gobierno recurre a estos especialistas en situaciones que, normalmente, suponen una amenaza para su integridad. Trabajan codo con codo y hacen lo que sea necesario para proteger los intereses nacionales."
